video_id,segment_id,start,end,duration,text_whisper,text_clean,text_final,review_decision,quality_level
uYOBciakYs4,0,0.0,6.400000095367432,6.400000095367432,Mưa lớn liên tục từ đêm qua đến chiều nay ở Trung Bộ đã khiến nước lũ trên các sông bắt đầu lên.,Mưa lớn liên tục từ đêm qua đến chiều nay ở Trung Bộ đã khiến nước lũ trên các sông bắt đầu dâng cao.,Mưa lớn liên tục từ đêm qua đến chiều nay ở Trung Bộ đã khiến nước lũ trên các sông bắt đầu dâng cao.,OK,HIGH
uYOBciakYs4,1,6.400000095367432,13.0,6.599999904632568,Dự báo là trong đêm nay và ngày mai tiếp tục là giai đoạn cao điểm mưa lớn ở Đà Nẵng đến Phú Yên và Bắc Tây Nguyên.,"Dự báo trong đêm nay và ngày mai sẽ tiếp tục là giai đoạn cao điểm mưa lớn từ Đà Nẵng đến Phú Yên và Bắc Tây Nguyên, với lượng mưa phổ biến từ 50 đến 150mm, có nơi trên 150mm.",Dự báo là trong đêm nay và ngày mai tiếp tục là giai đoạn cao điểm mưa lớn ở Đà Nẵng đến Phú Yên và Bắc Tây Nguyên.,REVERT,HIGH
uYOBciakYs4,2,13.0,18.479999542236328,5.479999542236328,"Lượng mưa phổ biến từ 50 đến 150mm, có nơi trên 150mm.","Lượng mưa phổ biến ở khu vực Đà Nẵng đến Phú Yên và Bắc Tây Nguyên từ 50 đến 150mm, có nơi trên 150mm.","Lượng mưa phổ biến từ 50 đến 150mm, có nơi trên 150mm.",REVERT,HIGH
uYOBciakYs4,3,18.479999542236328,26.959999084472656,8.479999542236328,"Với khu vực Hà Tĩnh đến Thửa Thiên Huế, mưa kéo dài hơn đến ngày 10 tháng 10, với tổng lượng mưa phổ biến là từ 300 đến 600mm.","Khu vực Hà Tĩnh đến Thừa Thiên Huế sẽ có mưa kéo dài đến ngày 10 tháng 10, với tổng lượng mưa phổ biến từ 300 đến 600mm.","Khu vực Hà Tĩnh đến Thừa Thiên Huế sẽ có mưa kéo dài đến ngày 10 tháng 10, với tổng lượng mưa phổ biến từ 300 đến 600mm.",OK,HIGH
uYOBciakYs4,4,26.959999084472656,30.959999084472656,4.0,"Mưa lớn sẽ gây ra một đợt lũ trên các sông ở Trung Bộ, Tây Nguyên.","Mưa lớn sẽ gây ra một đợt lũ trên các sông ở Trung Bộ và Tây Nguyên, với đỉnh lũ thượng lưu có khả năng lên mức báo động 3 và đỉnh lũ hạ lưu từ Hà Tĩnh đến Quảng Trị quanh mức báo động 2.","Mưa lớn sẽ gây ra một đợt lũ trên các sông ở Trung Bộ, Tây Nguyên.",REVERT,HIGH
uYOBciakYs4,5,30.959999084472656,36.959999084472656,6.0,"Trong đợt lũ này, đỉnh lũ thượng lưu các sông và các sông suối nhỏ có khả năng lên mức báo động 3.","Trong đợt lũ này, đỉnh lũ thượng lưu các sông và các sông suối nhỏ có khả năng đạt mức báo động 3.","Trong đợt lũ này, đỉnh lũ thượng lưu các sông và các sông suối nhỏ có khả năng đạt mức báo động 3.",OK,HIGH
uYOBciakYs4,6,36.959999084472656,42.959999084472656,6.0,"Còn đỉnh lũ ở hạ lưu các sông từ Hà Tĩnh đến Quảng Trị sẽ quanh mức báo động 2,","Đỉnh lũ ở hạ lưu các sông từ Hà Tĩnh đến Quảng Trị sẽ ở mức báo động 2, có khả năng gây xói lở bờ sông, chân đê và ngập úng ở vùng trũng thấp.","Còn đỉnh lũ ở hạ lưu các sông từ Hà Tĩnh đến Quảng Trị sẽ quanh mức báo động 2,",REVERT,LOW
uYOBciakYs4,7,42.959999084472656,47.959999084472656,5.0,"có thể gây xói lở bờ sông, chân đê và ngập úng ở vùng trụng thấp.","Mưa lớn kéo dài từ đêm qua đến chiều nay ở Trung Bộ đã khiến nước lũ trên các sông bắt đầu dâng cao, với khả năng gây xói lở bờ sông, chân đê và ngập úng ở vùng trũng thấp.","có thể gây xói lở bờ sông, chân đê và ngập úng ở vùng trụng thấp.",REVERT,HIGH
