video_id,segment_id,start,end,duration,text_whisper,text_clean,text_final,review_decision,quality_level
Ne2AeutGhJM,61,310.6000061035156,314.6000061035156,4.0,"Nhưng cái hố này nó nằm trên cái dòng suối, nhiều hố chứ không phải chỉ một hố đó.","Địa phương đã kiểm tra và xác nhận rằng cái hố này nằm trên dòng suối, có nhiều hố chứ không chỉ một hố duy nhất.","Nhưng cái hố này nó nằm trên cái dòng suối, nhiều hố chứ không phải chỉ một hố đó.",REVERT,LOW
Ne2AeutGhJM,62,314.6000061035156,318.6000061035156,4.0,Cho nên địa phương cũng cảnh báo và cũng thông báo với thôn,Địa phương cũng đã cảnh báo và thông báo với thôn về sự nguy hiểm của những hố sâu tại khu vực núi Đá Voi.,Cho nên địa phương cũng cảnh báo và cũng thông báo với thôn,REVERT,LOW
Ne2AeutGhJM,63,318.6000061035156,322.6000061035156,4.0,để mà ngăn chặn kịp thời những các em mà đùa nghịch đi ngang cái vùng đó.,"Địa phương cũng đã đến kiểm tra hố sâu này, nhưng hố nằm trên dòng suối và có nhiều hố khác, vì vậy họ đã thông báo với thôn để kịp thời ngăn chặn những em nhỏ đùa nghịch gần khu vực đó.",để mà ngăn chặn kịp thời những các em mà đùa nghịch đi ngang cái vùng đó.,REVERT,LOW
Ne2AeutGhJM,64,322.6000061035156,326.6000061035156,4.0,Nhiều địa phương ở các tỉnh Nam Trung Bồ xuất hiện những hố nước tử thần trong mùa mưa.,"Nhiều địa phương ở các tỉnh Nam Trung Bộ đang xuất hiện những hố nước tử thần trong mùa mưa, do việc khai thác khoáng sản và đào ao lấy nước trong mùa nắng.",Nhiều địa phương ở các tỉnh Nam Trung Bồ xuất hiện những hố nước tử thần trong mùa mưa.,REVERT,HIGH
Ne2AeutGhJM,65,326.6000061035156,329.6000061035156,3.0,"Đó là bởi trong mùa nắng hoặc người dân đào ao lấy nước,","Nhiều địa phương ở các tỉnh Nam Trung Bộ xuất hiện những hố nước tử thần trong mùa mưa, do trong mùa nắng, người dân đào ao lấy nước hoặc khai thác khoáng sản.","Đó là bởi trong mùa nắng hoặc người dân đào ao lấy nước,",REVERT,LOW
Ne2AeutGhJM,66,329.6000061035156,331.6000061035156,2.0,hoặc là do khai thác văn sản.,Có thể là do khai thác khoáng sản.,hoặc là do khai thác văn sản.,REVERT,LOW
Ne2AeutGhJM,67,331.6000061035156,335.6000061035156,4.0,"Điều đang nói, không phải lúc nào những khu vực hố sâu nguy hiểm cũng có biện canh báo.",Điều đáng nói là không phải lúc nào những khu vực có hố sâu nguy hiểm cũng được cảnh báo.,Điều đáng nói là không phải lúc nào những khu vực có hố sâu nguy hiểm cũng được cảnh báo.,OK,HIGH
Ne2AeutGhJM,68,335.6000061035156,338.6000061035156,3.0,"Sau cái chết thương tâm của đứa trẻ, người dân thôn trà sơn,","Sau cái chết thương tâm của em Nguyễn Hòa Nhân, 12 tuổi, người dân thôn Trà Sơn, xã Cam Phước Đông, thành phố Cam Ranh, tỉnh Khánh Hòa càng thêm lo lắng vì vẫn còn nhiều hố nước nguy hiểm trong khu vực.","Sau cái chết thương tâm của đứa trẻ, người dân thôn trà sơn,",REVERT,LOW
Ne2AeutGhJM,69,338.6000061035156,342.6000061035156,4.0,xài cam thuốc đông càng thêm lo lắng bởi lúc này vẫn còn đó những hố nước nguy hiểm.,"Sau cái chết thương tâm của em Nguyễn Hòa Nhân, người dân thôn Trà Sơn, xã Cam Phước Đông càng thêm lo lắng bởi hiện tại vẫn còn nhiều hố nước nguy hiểm.",xài cam thuốc đông càng thêm lo lắng bởi lúc này vẫn còn đó những hố nước nguy hiểm.,REVERT,LOW
