video_id,segment_id,start,end,duration,text_whisper,text_clean,text_final,review_decision,quality_level
LhDQoZKqDRY,0,0.0,9.0,9.0,"Còn bây giờ sẽ là những thông tin dự báo tuy tiết, chị Yến, bão số 7 đã trở thành áp thấp nhiệt đới trước khi vào bờ, vậy thì nó còn mối nguy gì hay không ạ?","Hiện tại, bão số 7 đã suy yếu thành áp thấp nhiệt đới trước khi vào bờ, nhưng hoàn lưu sau bão kết hợp với không khí lạnh vẫn có thể gây ra mưa lớn tại nhiều khu vực, dự kiến kéo dài đến thứ Sáu tới đây.","Còn bây giờ sẽ là những thông tin dự báo tuy tiết, chị Yến, bão số 7 đã trở thành áp thấp nhiệt đới trước khi vào bờ, vậy thì nó còn mối nguy gì hay không ạ?",REVERT,LOW
LhDQoZKqDRY,1,9.0,17.0,8.0,"Vâng ạ, dù là cơn bão số 7 đã xuyên yếu thành áp thấp nhiệt đới rồi, tuy nhiên thì hoàn lưu sau bão của nó kết hợp với không khí lạnh thì sẽ gây ra mưa lớn tại nhiều khu vực","Mặc dù cơn bão số 7 đã suy yếu thành áp thấp nhiệt đới, nhưng hoàn lưu sau bão kết hợp với không khí lạnh sẽ gây ra mưa lớn tại nhiều khu vực.","Mặc dù cơn bão số 7 đã suy yếu thành áp thấp nhiệt đới, nhưng hoàn lưu sau bão kết hợp với không khí lạnh sẽ gây ra mưa lớn tại nhiều khu vực.",OK,HIGH
LhDQoZKqDRY,2,17.0,25.0,8.0,và dự kiến là đợt mưa này sẽ có thể là kéo dài đến thứ 6 tới đây. Và cụ thể là vùng mưa to sẽ tập trung tại những đâu thì ngay bây giờ tôi sẽ cập nhật đến Anh Dương và quý vị khán giả.,"Dự kiến, đợt mưa này sẽ kéo dài đến thứ Sáu tới, với vùng mưa to tập trung tại các khu vực đồng bằng, ven biển Bắc Bộ, Yên Bái, Sơn La, Hòa Bình, Thanh Hóa, Nghệ An và Hà Tĩnh, tổng lượng mưa từ 150 đến 250mm, có nơi vượt 300mm.",và dự kiến là đợt mưa này sẽ có thể là kéo dài đến thứ 6 tới đây. Và cụ thể là vùng mưa to sẽ tập trung tại những đâu thì ngay bây giờ tôi sẽ cập nhật đến Anh Dương và quý vị khán giả.,REVERT,MEDIUM
LhDQoZKqDRY,3,25.0,46.0,21.0,"Thưa quý vị, quan sát trên bản đố mưa để có thể dễ dàng nhận thấy là vùng mưa to sẽ tập trung tại khu vực đồng bằng, khu vực ven biển Bắc Bộ cũng như là Yên Bái, Sơn La, Hòa Bình, Thanh Hóa, Nghệ An và Hà Tĩnh với tổng lượng mưa là từ 150 đến 250mm và có những nơi tương ứng với những vùng màu vàng như thế này thì có thể vượt 300mm.","Thưa quý vị, theo bản đồ mưa, vùng mưa to sẽ tập trung tại khu vực đồng bằng, ven biển Bắc Bộ, cùng với các tỉnh Yên Bái, Sơn La, Hòa Bình, Thanh Hóa, Nghệ An và Hà Tĩnh, với tổng lượng mưa từ 150 đến 250mm, và một số nơi có thể vượt quá 300mm.","Thưa quý vị, theo bản đồ mưa, vùng mưa to sẽ tập trung tại khu vực đồng bằng, ven biển Bắc Bộ, cùng với các tỉnh Yên Bái, Sơn La, Hòa Bình, Thanh Hóa, Nghệ An và Hà Tĩnh, với tổng lượng mưa từ 150 đến 250mm, và một số nơi có thể vượt quá 300mm.",OK,HIGH
LhDQoZKqDRY,4,46.0,58.0,12.0,"Với lượng mưa như thế này thì tại các khu vực trũng thấp hay là những khu đầu thị rất có thể là xảy ra tình trạng ngập úng, còn tại vùng núi thì cần phải cảnh giác với mối nguy hiểm từ sạt lở đất và lũ quét.","Với lượng mưa như vậy, tại các khu vực trũng thấp và những khu đô thị có khả năng xảy ra tình trạng ngập úng, trong khi tại vùng núi cần cảnh giác với nguy cơ sạt lở đất và lũ quét.","Với lượng mưa như vậy, tại các khu vực trũng thấp và những khu đô thị có khả năng xảy ra tình trạng ngập úng, trong khi tại vùng núi cần cảnh giác với nguy cơ sạt lở đất và lũ quét.",OK,HIGH
LhDQoZKqDRY,5,58.0,73.0,15.0,"Ngoài ra thì lũ trên các sông có thể lên, đặc biệt là tại những sông suối nhỏ nước rồn về nhanh, dễ gây ra ngập ngầm tràm. Để đảm bảo an toàn tính mạng thì bà con tuyệt đối là không đi qua những ngầm tràm bị ngập cũng như là không đánh bắt cá vớt củi trên sông khi mà lũ về.","Lũ trên các sông có thể dâng cao, đặc biệt tại những sông suối nhỏ, nơi nước rồn về nhanh, dễ gây ra ngập ngầm tràm; vì vậy, để đảm bảo an toàn tính mạng, bà con tuyệt đối không đi qua những ngầm tràm bị ngập và không đánh bắt cá hay vớt củi trên sông khi lũ về.","Lũ trên các sông có thể dâng cao, đặc biệt tại những sông suối nhỏ, nơi nước rồn về nhanh, dễ gây ra ngập ngầm tràm; vì vậy, để đảm bảo an toàn tính mạng, bà con tuyệt đối không đi qua những ngầm tràm bị ngập và không đánh bắt cá hay vớt củi trên sông khi lũ về.",OK,HIGH
LhDQoZKqDRY,6,74.0,85.0,11.0,Một thông tin rất đáng chú ý khác đó là ngay sau cơn bão số 7 này thì khả năng biển đông lạnh tiếp tục đoán bão bởi hiện tại xuất hiện một áp thấp nhiệt đới đang ở khu vực miền trung của Philippines.,"Một thông tin rất đáng chú ý là ngay sau cơn bão số 7, khả năng Biển Đông sẽ tiếp tục xuất hiện bão do hiện tại có một áp thấp nhiệt đới đang ở khu vực miền Trung của Philippines.","Một thông tin rất đáng chú ý là ngay sau cơn bão số 7, khả năng Biển Đông sẽ tiếp tục xuất hiện bão do hiện tại có một áp thấp nhiệt đới đang ở khu vực miền Trung của Philippines.",OK,HIGH
LhDQoZKqDRY,7,85.0,93.0,8.0,Khoảng là ngày mai thôi thì nó sẽ đi vào khu vực biển đông và sau đó dự báo là sẽ mạnh lên thành bão và hướng thẳng vào khu vực trung trung bộ của nước ta.,"Khoảng ngày mai, áp thấp nhiệt đới sẽ đi vào khu vực Biển Đông và dự báo sẽ mạnh lên thành bão, hướng thẳng vào khu vực Trung Trung Bộ của nước ta.","Khoảng ngày mai, áp thấp nhiệt đới sẽ đi vào khu vực Biển Đông và dự báo sẽ mạnh lên thành bão, hướng thẳng vào khu vực Trung Trung Bộ của nước ta.",OK,HIGH
LhDQoZKqDRY,8,93.0,102.0,9.0,Trong khi không khí lạnh đang dồn xuống thì hai hình thế này kết hợp với nhau sẽ khiến cho mưa lớn quay trở lại khoảng từ chiều tới ngày thứ 6 và kéo dài sang đến tuần sau.,"Trong khi không khí lạnh đang dồn xuống, sự kết hợp của hai hình thế này sẽ khiến mưa lớn quay trở lại từ chiều thứ Sáu và kéo dài sang tuần sau.",Trong khi không khí lạnh đang dồn xuống thì hai hình thế này kết hợp với nhau sẽ khiến cho mưa lớn quay trở lại khoảng từ chiều tới ngày thứ 6 và kéo dài sang đến tuần sau.,REVERT,HIGH
LhDQoZKqDRY,9,102.0,111.0,9.0,Lo ngại hơn là những nơi vừa bị thiệt hại nặng nề do mưa lũ đó là từ Quảng Bình đến Quảng Ngãi thì sẽ là trọng tâm mưa của lần này.,"Lo ngại hơn cả là những khu vực vừa chịu thiệt hại nặng nề do mưa lũ, từ Quảng Bình đến Quảng Ngãi, sẽ trở thành trọng tâm của đợt mưa này.","Lo ngại hơn cả là những khu vực vừa chịu thiệt hại nặng nề do mưa lũ, từ Quảng Bình đến Quảng Ngãi, sẽ trở thành trọng tâm của đợt mưa này.",OK,HIGH
LhDQoZKqDRY,10,111.0,118.0,7.0,"Không có nhiều thời gian nữa bà con phải khẩn trương chuẩn bị ứng phó với nguy cơ về mưa chổng mưa, lũ chổng lũ bằng những phương án ngay sau đây.","Bà con cần khẩn trương chuẩn bị ứng phó với nguy cơ mưa lớn và lũ lụt bằng các phương án sau đây, vì thời gian không còn nhiều.","Bà con cần khẩn trương chuẩn bị ứng phó với nguy cơ mưa lớn và lũ lụt bằng các phương án sau đây, vì thời gian không còn nhiều.",OK,HIGH
LhDQoZKqDRY,11,118.0,128.0,10.0,"Thường xuyên theo dõi diễn biến thiên tai, dự trữ lương thực, nước sạch, thuốc men, di chuyển người, tài sản đến nơi an toàn, tuân thủ hướng dẫn của các cơ quan chức năng.","Thường xuyên theo dõi diễn biến thiên tai, dự trữ lương thực, nước sạch, thuốc men, di chuyển người và tài sản đến nơi an toàn, đồng thời tuân thủ hướng dẫn của các cơ quan chức năng.","Thường xuyên theo dõi diễn biến thiên tai, dự trữ lương thực, nước sạch, thuốc men, di chuyển người và tài sản đến nơi an toàn, đồng thời tuân thủ hướng dẫn của các cơ quan chức năng.",OK,HIGH
LhDQoZKqDRY,12,128.0,133.0,5.0,Còn bây giờ sẽ được chuyển sang những thông tin dự báo chi tiết cho một số thành phố trong đêm nay và ngày mai.,"Còn bây giờ, chúng tôi sẽ chuyển sang thông tin dự báo chi tiết cho một số thành phố trong đêm nay và ngày mai.","Còn bây giờ, chúng tôi sẽ chuyển sang thông tin dự báo chi tiết cho một số thành phố trong đêm nay và ngày mai.",OK,HIGH
LhDQoZKqDRY,13,133.0,141.0,8.0,"Thành phố Hà Nội đêm nay có mưa to, trời lạnh 21 độ. Ngày mai dự báo vẫn mưa lạnh cả ngày, nhiệt độ không vượt quá 24 độ.","Thành phố Hà Nội đêm nay có mưa to, nhiệt độ 21 độ, và ngày mai dự báo vẫn có mưa lạnh kéo dài cả ngày với nhiệt độ không vượt quá 24 độ.","Thành phố Hà Nội đêm nay có mưa to, nhiệt độ 21 độ, và ngày mai dự báo vẫn có mưa lạnh kéo dài cả ngày với nhiệt độ không vượt quá 24 độ.",OK,HIGH
LhDQoZKqDRY,14,141.0,149.0,8.0,"Thành phố Huế đêm nay có lúc có mưa rào 23 độ. Ngày mai mưa xảy ra ngắt quãng với lượng nhỏ, nhiệt độ cao nhất khoảng là 29 độ.","Thành phố Huế đêm nay có lúc mưa rào với nhiệt độ 23 độ, trong khi ngày mai mưa sẽ xảy ra ngắt quãng với lượng nhỏ, nhiệt độ cao nhất khoảng 29 độ.","Thành phố Huế đêm nay có lúc mưa rào với nhiệt độ 23 độ, trong khi ngày mai mưa sẽ xảy ra ngắt quãng với lượng nhỏ, nhiệt độ cao nhất khoảng 29 độ.",OK,HIGH
LhDQoZKqDRY,15,149.0,159.0,10.0,"Thành phố Hồ Chí Minh đêm nay mưa rào 24 độ. Sáng đến trưa mai nắng gián đoạn 30 độ. Về chiều cảnh báo mưa to, trong cơn giông có thể đi kèm với lức xoáy và gió giật mạnh.","Thành phố Hồ Chí Minh đêm nay có mưa rào với nhiệt độ 24 độ, sáng đến trưa mai nắng gián đoạn với nhiệt độ 30 độ, và vào chiều có cảnh báo mưa to, trong cơn giông có thể xuất hiện lốc xoáy và gió giật mạnh.","Thành phố Hồ Chí Minh đêm nay có mưa rào với nhiệt độ 24 độ, sáng đến trưa mai nắng gián đoạn với nhiệt độ 30 độ, và vào chiều có cảnh báo mưa to, trong cơn giông có thể xuất hiện lốc xoáy và gió giật mạnh.",OK,HIGH
