video_id,segment_id,start,end,duration,text_whisper,text_clean,text_final,review_decision,quality_level
Nac9Drm3b0E,0,0.0,7.360000133514404,7.360000133514404,"Mỗi khi có bảo vệ, dân làng Tai O, một ngôi làng trài truyền thống của Hồng Kông, Trung Quốc lại sống trong sợ hãi","Mỗi khi có bảo vệ, dân làng Tai O, một ngôi làng trài truyền thống của Hồng Kông, Trung Quốc lại sống trong sợ hãi","Mỗi khi có bảo vệ, dân làng Tai O, một ngôi làng trài truyền thống của Hồng Kông, Trung Quốc lại sống trong sợ hãi",OK,HIGH
Nac9Drm3b0E,1,7.360000133514404,11.68000030517578,4.320000171661375,bởi mực nước biển dân cao đang khiến cho ngôi làng này có nguy cơ biến mất.,bởi mực nước biển dân cao đang khiến cho ngôi làng này có nguy cơ biến mất.,bởi mực nước biển dân cao đang khiến cho ngôi làng này có nguy cơ biến mất.,OK,HIGH
Nac9Drm3b0E,2,16.479999542236328,21.84000015258789,5.3600006103515625,"Làng Tai O với những ngôi nhà san sát bao quanh bởi những chiếc thuyền đánh cá, có thể không còn nữa.","Làng Tai O với những ngôi nhà san sát bao quanh bởi những chiếc thuyền đánh cá, có thể không còn nữa.","Làng Tai O với những ngôi nhà san sát bao quanh bởi những chiếc thuyền đánh cá, có thể không còn nữa.",OK,HIGH
Nac9Drm3b0E,3,21.84000015258789,26.799999237060547,4.959999084472656,"Các chuyên gia cảnh báo rằng do mực nước biển dân, cả làng sẽ sớm chìm dưới biển.","Các chuyên gia cảnh báo rằng do mực nước biển dân, cả làng sẽ sớm chìm dưới biển.","Các chuyên gia cảnh báo rằng do mực nước biển dân, cả làng sẽ sớm chìm dưới biển.",OK,HIGH
Nac9Drm3b0E,4,27.68000030517578,34.20000076293945,6.520000457763672,Làng đã bị ảnh hưởng nặng nề bởi nước biển xâm thực và lũ lụt nghiêm trọng do hai trận siêu bão mấy năm gần đây.,Làng đã bị ảnh hưởng nặng nề bởi nước biển xâm thực và lũ lụt nghiêm trọng do hai trận siêu bão mấy năm gần đây.,Làng đã bị ảnh hưởng nặng nề bởi nước biển xâm thực và lũ lụt nghiêm trọng do hai trận siêu bão mấy năm gần đây.,OK,HIGH
Nac9Drm3b0E,5,34.20000076293945,42.79999923706055,8.599998474121094,"Ông Ôn Phúc Minh sống ở làng Tai O. Nhà ông được truyền qua các thế hệ ra biển đánh bắt cá, đã ăn sâu vào máu của họ.","Ông Ôn Phúc Minh sống ở làng Tai O. Nhà ông được truyền qua các thế hệ ra biển đánh bắt cá, đã ăn sâu vào máu của họ.","Ông Ôn Phúc Minh sống ở làng Tai O. Nhà ông được truyền qua các thế hệ ra biển đánh bắt cá, đã ăn sâu vào máu của họ.",OK,HIGH
Nac9Drm3b0E,6,42.79999923706055,52.91999816894531,10.119998931884766,Tôi đã sống ở đây hơn 80 năm rồi. Cơn bão đầu tiên gây ảnh hưởng lớn đến chúng tôi là báo Hagubit năm 2008.,Tôi đã sống ở đây hơn 80 năm rồi. Cơn bão đầu tiên gây ảnh hưởng lớn đến chúng tôi là báo Hagubit năm 2008.,Tôi đã sống ở đây hơn 80 năm rồi. Cơn bão đầu tiên gây ảnh hưởng lớn đến chúng tôi là báo Hagubit năm 2008.,OK,HIGH
Nac9Drm3b0E,7,53.2400016784668,58.7599983215332,5.519996643066406,Nước lũ cần ngập bản ăn. Lúc đó tôi đã nghĩ là trận lũ lụt lớn nhất từng thấy trong đời mình.,Nước lũ cần ngập bản ăn. Lúc đó tôi đã nghĩ là trận lũ lụt lớn nhất từng thấy trong đời mình.,Nước lũ cần ngập bản ăn. Lúc đó tôi đã nghĩ là trận lũ lụt lớn nhất từng thấy trong đời mình.,OK,HIGH
Nac9Drm3b0E,8,58.7599983215332,66.76000213623047,8.000003814697266,"Nhưng năm 2018, bão Mangkut còn ghê gớm hơn. Nước lũ cao hơn bão Hagubit 5cm.","Nhưng năm 2018, bão Mangkut còn ghê gớm hơn. Nước lũ cao hơn bão Hagubit 5cm.","Nhưng năm 2018, bão Mangkut còn ghê gớm hơn. Nước lũ cao hơn bão Hagubit 5cm.",OK,HIGH
Nac9Drm3b0E,9,66.76000213623047,70.76000213623047,4.0,Nước lũ khoảng tầm này này. Tất cả đồ đạc trong nhà đều chìm trong nước lũ.,Nước lũ khoảng tầm này này. Tất cả đồ đạc trong nhà đều chìm trong nước lũ.,Nước lũ khoảng tầm này này. Tất cả đồ đạc trong nhà đều chìm trong nước lũ.,OK,HIGH
Nac9Drm3b0E,10,73.23999786376953,79.23999786376953,6.0,Trải nghiệm kinh hoàng sau trận bão Hagubit năm 2008 đã khiến chính quyền Hồng Kông phải vào cuộc.,Trải nghiệm kinh hoàng sau trận bão Hagubit năm 2008 đã khiến chính quyền Hồng Kông phải vào cuộc.,Trải nghiệm kinh hoàng sau trận bão Hagubit năm 2008 đã khiến chính quyền Hồng Kông phải vào cuộc.,OK,HIGH
Nac9Drm3b0E,11,79.55999755859375,85.55999755859375,6.0,Các hàng rào trận lũ tạm thời được dựng lên tại các khu vực bị ảnh hưởng trước khi bão vào để ngăn nước lũ ngập sâu vào trung tâm làng.,Các hàng rào trận lũ tạm thời được dựng lên tại các khu vực bị ảnh hưởng trước khi bão vào để ngăn nước lũ ngập sâu vào trung tâm làng.,Các hàng rào trận lũ tạm thời được dựng lên tại các khu vực bị ảnh hưởng trước khi bão vào để ngăn nước lũ ngập sâu vào trung tâm làng.,OK,HIGH
Nac9Drm3b0E,12,85.55999755859375,90.55999755859376,5.000000000000014,Chính quyền cũng đầu tư thay mới đồ gia dục cho người dân nếu bị hỏng.,Chính quyền cũng đầu tư thay mới đồ gia dục cho người dân nếu bị hỏng.,Chính quyền cũng đầu tư thay mới đồ gia dục cho người dân nếu bị hỏng.,OK,HIGH
Nac9Drm3b0E,13,91.55999755859376,102.55999755859376,11.0,"Bất cứ khi nào có bão cả làng sợ hãi, chúng tôi phải chuẩn bị các biện pháp phòng ngừa cũng như triển khai tình nguyện viên và hợp tác chặt chẽ với chính quyền.","Bất cứ khi nào có bão cả làng sợ hãi, chúng tôi phải chuẩn bị các biện pháp phòng ngừa cũng như triển khai tình nguyện viên và hợp tác chặt chẽ với chính quyền.","Bất cứ khi nào có bão cả làng sợ hãi, chúng tôi phải chuẩn bị các biện pháp phòng ngừa cũng như triển khai tình nguyện viên và hợp tác chặt chẽ với chính quyền.",OK,HIGH
Nac9Drm3b0E,14,102.87999725341795,109.87999725341795,7.0,"Khi có bão, Hồng Kông phải triển khai các biện pháp phòng ngừa bảo vệ.","Khi có bão, Hồng Kông phải triển khai các biện pháp phòng ngừa bảo vệ.","Khi có bão, Hồng Kông phải triển khai các biện pháp phòng ngừa bảo vệ.",OK,HIGH
Nac9Drm3b0E,15,109.87999725341795,116.87999725341795,7.0,"Nhưng đến cuối thế kỷ này, tôi nghĩ điều đó sẽ rất tốn kém và khi đó tôi sợ rằng họ phải di chuyển lên chỗ cao hơn.","Nhưng đến cuối thế kỷ này, tôi nghĩ điều đó sẽ rất tốn kém và khi đó tôi sợ rằng họ phải di chuyển lên chỗ cao hơn.","Nhưng đến cuối thế kỷ này, tôi nghĩ điều đó sẽ rất tốn kém và khi đó tôi sợ rằng họ phải di chuyển lên chỗ cao hơn.",OK,HIGH
Nac9Drm3b0E,16,122.87999725341795,125.87999725341795,3.0,Làng Tai O không phải là khu vực duy nhất gặp rủi ro.,Làng Tai O không phải là khu vực duy nhất gặp rủi ro.,Làng Tai O không phải là khu vực duy nhất gặp rủi ro.,OK,HIGH
Nac9Drm3b0E,17,125.87999725341795,130.8800048828125,5.0000076293945455,Phần phía đông của đảo Hồng Kông cũng đối mặt với thủ chiếu nghiêm trọng trong hai trận siêu bão.,Phần phía đông của đảo Hồng Kông cũng đối mặt với thủ chiếu nghiêm trọng trong hai trận siêu bão.,Phần phía đông của đảo Hồng Kông cũng đối mặt với thủ chiếu nghiêm trọng trong hai trận siêu bão.,OK,HIGH
Nac9Drm3b0E,18,131.1999969482422,134.1999969482422,3.0,Nhiều khu dân cư rộng lớn cũng bị ngập nặng.,Nhiều khu dân cư rộng lớn cũng bị ngập nặng.,Nhiều khu dân cư rộng lớn cũng bị ngập nặng.,OK,HIGH
Nac9Drm3b0E,19,136.1999969482422,140.1999969482422,4.0,"Mặc dù mực đất biển dân sẽ không gây ra lũ lụt quy mô lớn ngay lập tức,","Mặc dù mực đất biển dân sẽ không gây ra lũ lụt quy mô lớn ngay lập tức,","Mặc dù mực đất biển dân sẽ không gây ra lũ lụt quy mô lớn ngay lập tức,",OK,HIGH
Nac9Drm3b0E,20,140.1999969482422,146.1999969482422,6.0,nhưng Hồng Kông sẽ dễ bị tổn thương hơn trước tác động của nước dân cao do bão gây ra.,nhưng Hồng Kông sẽ dễ bị tổn thương hơn trước tác động của nước dân cao do bão gây ra.,nhưng Hồng Kông sẽ dễ bị tổn thương hơn trước tác động của nước dân cao do bão gây ra.,OK,HIGH
