id,start,end,duration,text_len,text,video_id
0,0.0,7.0,7.0,125,"Ba ngày nay, nhiều người dân ở tỉnh Quảng Trị vẫn đang sống trong tình cảnh ngập lụt, thiếu nước uống, lương thực, thực phẩm.",NTTgihBWFoQ
1,7.0,12.0,5.0,96,"Lúa thì bị hư hại nhiều do ngập lụt, chăn nuôi ra xốp ra cầm thủy sản thì đều bị nước cuốn trôi.",NTTgihBWFoQ
2,12.0,15.0,3.0,45,Người dân Quảng Trị đang gặp vô vàn khó khăn.,NTTgihBWFoQ
3,17.0,21.0,4.0,69,Bãi thốt ở vùng Càng thuộc huyền Hải Lăng với khoảng trên 300 hồ dân.,NTTgihBWFoQ
4,21.0,28.0,7.0,104,"Ba ngày nay, nhà người dân vẫn nằm sâu trong nước. Cuộc sống của người dân ở đây gặp rất nhiều khó khăn.",NTTgihBWFoQ
5,31.0,43.0,12.0,74,"Huyền Hải Lăng có gần 17 ngàn ngôi nhà bị ngập, nhiều nhất tỉnh Quảng Trị.",NTTgihBWFoQ
6,43.0,47.0,4.0,70,"Do lụt ngâm lâu ngày nên người dân đang khó khăn, thiếu thốn, đủ điều.",NTTgihBWFoQ
7,61.0,70.0,9.0,112,"Theo thống kế chưa đầy đủ, hiện tại ở huyền Hải Lăng có khoảng trên 10 ngàn tấn lúa bị ướt do lụt ngâm lâu ngày.",NTTgihBWFoQ
8,70.0,75.0,5.0,90,"Hàng chục ngàn gia súc, gia cầm bị chết, gần 100 hectare nuôi trồng thủy sản bị cuốn trôi.",NTTgihBWFoQ
9,90.0,103.0,13.0,76,"Tính đến thời điểm này, tỉnh Quảng Trị đã có 3 người chết, 7 người mất tích.",NTTgihBWFoQ
10,103.0,110.0,7.0,131,"Nước lụt lên quá nhanh. Ở hầu hết chính huyền thị xã thành phố của tỉnh Quảng Trị, tài sản của người dân gần như hư hỏng hoàn toàn.",NTTgihBWFoQ
11,110.0,118.0,8.0,131,"Trên 700 hectare nuôi trồng thủy sản bị nước cuốn trôi, trên 50 ngàn con gia súc, gia cầm bị chết, gần 800 hectare hoa màu bị ngập.",NTTgihBWFoQ
12,119.0,125.0,6.0,104,"Vừa trải qua dịch bệnh Covid-19, nay lại đối mặt với cơn lụ, quá khắc nhiệt đối với người dân Quảng Trị.",NTTgihBWFoQ
13,128.0,136.0,8.0,163,"Còn tại Quảng Bình, nhằm hỗ trợ bà con vùng bị chia cắt cô lập bởi mưa lũ, nhiều đoàn công tác cứu trợ đã tìm mọi cách tiếp cận nhằm di rời hỗ trợ bà con nhân dân.",NTTgihBWFoQ
14,136.0,143.0,7.0,128,"Đồng thời, chính quyền tỉnh cùng các đơn vị lực lượng vũ trang đang tích cực trong việc giúp bà con khắc phục hậu quả do mưa lũ.",NTTgihBWFoQ
15,144.0,150.0,6.0,106,"Gia đình anh Hồ Báo và gần 200 hộ gia đình khác thuộc Ba Bản, biên giới của xã Thượng Hóa, đang bị cô lập.",NTTgihBWFoQ
16,151.0,156.0,5.0,87,"Các đoàn cứu trợ của Bộ Đội Biên Phòng đã phải dùng cano, súng máy mới có thể tiếp cận.",NTTgihBWFoQ
17,156.0,161.0,5.0,90,"Hơn 10 tấn gạo cùng các nhu hiếu phẩm, thuốc men đã đến được tận tay toàn bộ bà con ở đây.",NTTgihBWFoQ
18,161.0,173.0,12.0,91,"Trên địa bàn xã Thượng Hóa, huyện Minh Hóa, hơn 550 người nhà đã bị chìm sâu trong nước lũ.",NTTgihBWFoQ
19,173.0,176.0,3.0,60,"Tuy nhiên, bà con nơi đây vẫn an toàn nhờ nhờ phao tránh lũ.",NTTgihBWFoQ
20,176.0,182.0,6.0,118,Lực lượng chức năng và chính quyền tỉnh Quang Bình đã tiếp cận đến từng hộ dân động viên thăm hỏi và ứng cứu kịp thời.,NTTgihBWFoQ
21,183.0,190.0,7.0,96,"Mọi công tàc chuẩn bị như cơ sở vật chất, phương tiền, lực lượng để sẵn sàng cơ động tình huống.",NTTgihBWFoQ
22,190.0,196.0,6.0,111,"Hiện 47 thôn xã Bản trên toàn tỉnh Quang Bình bị chia cắt bởi nước lũ đã được các lực lượng chức năng tiếp cận,",NTTgihBWFoQ
23,196.0,203.0,7.0,124,đồng thời di rời 261 hộ dân với trên 900 người ra khỏi vùng nguy hiểm. Công tác hỗ trợ đang được triển khai trên riêng rộng.,NTTgihBWFoQ
24,203.0,210.0,7.0,110,"Hiện nay tỉnh cũng đang tập trung chỉ đạo tất cả các lực lượng cũng như công an, quân đội, biên phòng vào cuộc",NTTgihBWFoQ
25,210.0,213.0,3.0,44,và sẽ hỗ trợ cho bà con tư cách đầy đủ nhất.,NTTgihBWFoQ
26,213.0,219.0,6.0,106,"Cũng trong sáng nay, Bộ Tư lệnh Cảnh sát Biển Vùng 1 đã phối hợp với chính quyền tỉnh Quang Bình tiếp cận,",NTTgihBWFoQ
27,219.0,225.0,6.0,95,"động viên thăm hỏi tặng 100 thùng mì tôm, nước và tiền mặt cho bà con tại khu vực thôn Cồn Kết,",NTTgihBWFoQ
28,225.0,232.0,7.0,113,"phương Quảng Thuận, thị xã Bà Đồn, tỉnh Quang Bình. Dự báo trong mấy ngày tới, Quảng Bình có nguy cơ lũ trồng lũ.",NTTgihBWFoQ
29,232.0,236.0,4.0,99,"Ban Chỉ huy Phòng chống thiên tai và tìm kiếm cứu nạn tỉnh Quang Bình yêu cầu các đơn vị chức năng,",NTTgihBWFoQ
30,236.0,240.0,4.0,81,"lực lượng vũ trang trên toàn tỉnh chủ động ứng phó theo phương châm muốn tại chỗ,",NTTgihBWFoQ
31,240.0,243.0,3.0,61,"đồng thời chuẩn bị lương thực, thuốc men và các nhu yếu phẩm,",NTTgihBWFoQ
32,243.0,247.0,4.0,69,"các trang thiết bị cứu hộ, cứu nạn khi có tình huống khẩn cấp xảy ra.",NTTgihBWFoQ
