video_id,segment_id,start,end,duration,text_whisper,text_clean,text_final,review_decision,quality_level
O2h8VLHx7Sw,115,759.2999877929688,764.5800170898438,5.280029296875,"Người làng gần, làng xa, thậm chí người từ các tỉnh khác đến đây để đặt hàng, đóng những chiếc sổng.","Người làng gần, làng xa, thậm chí người từ các tỉnh khác đến đây để đặt hàng, đóng những chiếc sổng.","Người làng gần, làng xa, thậm chí người từ các tỉnh khác đến đây để đặt hàng, đóng những chiếc sổng.",OK,HIGH
O2h8VLHx7Sw,116,764.5800170898438,767.3800048828125,2.79998779296875,Mỗi tháng ông Bảy Trị đóng 6-7 chiếc sổng.,Mỗi tháng ông Bảy Trị đóng 6-7 chiếc sổng.,Mỗi tháng ông Bảy Trị đóng 6-7 chiếc sổng.,OK,HIGH
O2h8VLHx7Sw,117,779.1400146484375,783.2999877929688,4.15997314453125,"Một khi lũ lụt, những con đường trong thôn, trong xã chẳng thể nào đi lại như thế này.","Một khi lũ lụt, những con đường trong thôn, trong xã chẳng thể nào đi lại như thế này.","Một khi lũ lụt, những con đường trong thôn, trong xã chẳng thể nào đi lại như thế này.",OK,HIGH
O2h8VLHx7Sw,118,783.2999877929688,787.8599853515625,4.55999755859375,"Nước có dân linh cao, có sổng, may ràng nhanh chóng đến được nơi an toàn.","Nước có dân linh cao, có sổng, may ràng nhanh chóng đến được nơi an toàn.","Nước có dân linh cao, có sổng, may ràng nhanh chóng đến được nơi an toàn.",OK,HIGH
O2h8VLHx7Sw,119,787.8599853515625,790.8200073242188,2.96002197265625,"Người ta gọi đây là sổng cứu sinh, cũng vì lẽ đó.","Người ta gọi đây là sổng cứu sinh, cũng vì lẽ đó.","Người ta gọi đây là sổng cứu sinh, cũng vì lẽ đó.",OK,HIGH
