video_id,segment_id,start,end,duration,text_whisper,text_clean,text_final,review_decision,quality_level
qKL4b0D_Z5U,0,0.0,4.599999904632568,4.599999904632568,"Thưa quý vị, ngay bây giờ sẽ là thông tin mới nhất về cơn bão số 10.","Thưa quý vị, ngay bây giờ sẽ là thông tin mới nhất về cơn bão số 10.","Thưa quý vị, ngay bây giờ sẽ là thông tin mới nhất về cơn bão số 10.",OK,HIGH
qKL4b0D_Z5U,1,4.599999904632568,9.600000381469728,5.00000047683716,"Lúc 16h ngày hôm nay, cường độ của bão đang là vào khoảng cấp 8 và giật tới cấp 10.","Lúc 16h ngày hôm nay, cường độ của bão đang là vào khoảng cấp 8 và giật tới cấp 10.","Lúc 16h ngày hôm nay, cường độ của bão đang là vào khoảng cấp 8 và giật tới cấp 10.",OK,HIGH
qKL4b0D_Z5U,2,9.600000381469728,14.600000381469728,5.0,Tầm bão cách huyệt đảo Hoàng Sa là khoảng 360km về phía đông nam.,Tầm bão cách huyệt đảo Hoàng Sa là khoảng 360km về phía đông nam.,Tầm bão cách huyệt đảo Hoàng Sa là khoảng 360km về phía đông nam.,OK,HIGH
qKL4b0D_Z5U,3,14.600000381469728,17.600000381469727,2.9999999999999982,"Dự báo trong ngày mai, bão sẽ đi theo hướng tây tây nam.","Dự báo trong ngày mai, bão sẽ đi theo hướng tây tây nam.","Dự báo trong ngày mai, bão sẽ đi theo hướng tây tây nam.",OK,HIGH
qKL4b0D_Z5U,4,17.600000381469727,23.600000381469727,6.0,"Đến 16h ngày mai, tầm bão cách Quảng Ngãi đến Khánh Hòa khoảng 340km về phía đông.","Đến 16h ngày mai, tầm bão cách Quảng Ngãi đến Khánh Hòa khoảng 340km về phía đông.","Đến 16h ngày mai, tầm bão cách Quảng Ngãi đến Khánh Hòa khoảng 340km về phía đông.",OK,HIGH
qKL4b0D_Z5U,5,23.600000381469727,26.600000381469727,3.0,"Cường độ bão mạnh cấp 8, cấp 9 và giật tới cấp 11.","Cường độ bão mạnh cấp 8, cấp 9 và giật tới cấp 11.","Cường độ bão mạnh cấp 8, cấp 9 và giật tới cấp 11.",OK,HIGH
qKL4b0D_Z5U,6,26.600000381469727,33.599998474121094,6.999998092651367,"Lúc kia, bão sẽ suy yếu dần thành áp thấp nhiệt đới rồi đi vào đất liền Quảng Ngãi tới Khánh Hòa theo hướng tây tây nam.","Lúc kia, bão sẽ suy yếu dần thành áp thấp nhiệt đới rồi đi vào đất liền Quảng Ngãi tới Khánh Hòa theo hướng tây tây nam.","Lúc kia, bão sẽ suy yếu dần thành áp thấp nhiệt đới rồi đi vào đất liền Quảng Ngãi tới Khánh Hòa theo hướng tây tây nam.",OK,HIGH
qKL4b0D_Z5U,7,33.599998474121094,37.59999847412109,3.999999999999993,"Từ giờ cho đến khi yếu đi, bão sẽ tiếp tục gây thời tiết xấu ở trên biển.","Từ giờ cho đến khi yếu đi, bão sẽ tiếp tục gây thời tiết xấu ở trên biển.","Từ giờ cho đến khi yếu đi, bão sẽ tiếp tục gây thời tiết xấu ở trên biển.",OK,HIGH
qKL4b0D_Z5U,8,37.59999847412109,43.59999847412109,6.0,"Cảnh báo vùng nguy hiểm do bão trên Biển Đông trong 24h tới sẽ từ vị tuyến 12-16,5 độ vị Bắc,","Cảnh báo vùng nguy hiểm do bão trên Biển Đông trong 24h tới sẽ từ vị tuyến 12-16,5 độ vị Bắc,","Cảnh báo vùng nguy hiểm do bão trên Biển Đông trong 24h tới sẽ từ vị tuyến 12-16,5 độ vị Bắc,",OK,HIGH
qKL4b0D_Z5U,9,43.59999847412109,47.59999847412109,4.0,"từ kinh tuyến 110,5-117 độ Kinh Đông.","từ kinh tuyến 110,5-117 độ Kinh Đông.","từ kinh tuyến 110,5-117 độ Kinh Đông.",OK,HIGH
qKL4b0D_Z5U,10,47.59999847412109,52.59999847412109,5.0,Toàn bộ tàu thuyền hoạt động trong vùng nguy hiểm đều có nguy cơ cao chịu tác động của gió giật mạnh.,Toàn bộ tàu thuyền hoạt động trong vùng nguy hiểm đều có nguy cơ cao chịu tác động của gió giật mạnh.,Toàn bộ tàu thuyền hoạt động trong vùng nguy hiểm đều có nguy cơ cao chịu tác động của gió giật mạnh.,OK,HIGH
qKL4b0D_Z5U,11,53.59999847412109,60.59999847412109,7.0,"Cập nhật về công tác tìm kiếm 4 nạn nhân còn đang mất tích tại xã Phước Lộc, Phước Sơn, tỉnh Quảng Nam,","Cập nhật về công tác tìm kiếm 4 nạn nhân còn đang mất tích tại xã Phước Lộc, Phước Sơn, tỉnh Quảng Nam,","Cập nhật về công tác tìm kiếm 4 nạn nhân còn đang mất tích tại xã Phước Lộc, Phước Sơn, tỉnh Quảng Nam,",OK,HIGH
qKL4b0D_Z5U,12,60.59999847412109,64.5999984741211,4.000000000000007,thì vẫn đang được các lực lượng cứu nạn tích cực triển khai trong sáng nay.,thì vẫn đang được các lực lượng cứu nạn tích cực triển khai trong sáng nay.,thì vẫn đang được các lực lượng cứu nạn tích cực triển khai trong sáng nay.,OK,HIGH
qKL4b0D_Z5U,13,64.5999984741211,70.5999984741211,6.0,"Đây là hình ảnh của lực lượng bộ đội biên phòng tỉnh Quảng Nam tìm kiếm nạn nhân tại thôn 1, xã Phước Lộc.","Đây là hình ảnh của lực lượng bộ đội biên phòng tỉnh Quảng Nam tìm kiếm nạn nhân tại thôn 1, xã Phước Lộc.","Đây là hình ảnh của lực lượng bộ đội biên phòng tỉnh Quảng Nam tìm kiếm nạn nhân tại thôn 1, xã Phước Lộc.",OK,HIGH
qKL4b0D_Z5U,14,70.5999984741211,73.5999984741211,3.0,Tại đây đang còn một nạn nhân là cán bộ xã chưa được tìm thấy.,Tại đây đang còn một nạn nhân là cán bộ xã chưa được tìm thấy.,Tại đây đang còn một nạn nhân là cán bộ xã chưa được tìm thấy.,OK,HIGH
qKL4b0D_Z5U,15,73.5999984741211,78.5999984741211,5.0,"Tính đến chiều qua, lực lượng chức năng đã tìm thấy 9 thi thể nạn nhân trong vụ sập lở ở huyện Phước Sơn.","Tính đến chiều qua, lực lượng chức năng đã tìm thấy 9 thi thể nạn nhân trong vụ sập lở ở huyện Phước Sơn.","Tính đến chiều qua, lực lượng chức năng đã tìm thấy 9 thi thể nạn nhân trong vụ sập lở ở huyện Phước Sơn.",OK,HIGH
qKL4b0D_Z5U,16,79.5999984741211,83.5999984741211,4.0,Công tác tìm kiếm nạn nhân mất tích đang được triển khai song song cùng công tác tiếp tế lương thực.,Công tác tìm kiếm nạn nhân mất tích đang được triển khai song song cùng công tác tiếp tế lương thực.,Công tác tìm kiếm nạn nhân mất tích đang được triển khai song song cùng công tác tiếp tế lương thực.,OK,HIGH
qKL4b0D_Z5U,17,83.5999984741211,89.5999984741211,6.0,"Dự kiến trong ngày hôm nay, các lực lượng tiếp tục gùi cõng lương thực vào xã Phước Thành và Phước Lộc.","Dự kiến trong ngày hôm nay, các lực lượng tiếp tục gùi cõng lương thực vào xã Phước Thành và Phước Lộc.","Dự kiến trong ngày hôm nay, các lực lượng tiếp tục gùi cõng lương thực vào xã Phước Thành và Phước Lộc.",OK,HIGH
qKL4b0D_Z5U,18,89.5999984741211,93.5999984741211,4.0,"Đồng thời, máy bay trực thăng sẽ vận chuyển gạo vào xã Phước Lộc khi thời tiết thuận lợi.","Đồng thời, máy bay trực thăng sẽ vận chuyển gạo vào xã Phước Lộc khi thời tiết thuận lợi.","Đồng thời, máy bay trực thăng sẽ vận chuyển gạo vào xã Phước Lộc khi thời tiết thuận lợi.",OK,HIGH
qKL4b0D_Z5U,19,96.5999984741211,100.5999984741211,4.0,Những cơn mưa to đến rất to vẫn xảy ra trên địa bàn tỉnh Nghệ An.,Những cơn mưa to đến rất to vẫn xảy ra trên địa bàn tỉnh Nghệ An.,Những cơn mưa to đến rất to vẫn xảy ra trên địa bàn tỉnh Nghệ An.,OK,HIGH
qKL4b0D_Z5U,20,100.5999984741211,105.5999984741211,5.0,"Nói chung, vào huyện Hưng Nguyên nói riêng, kết hợp với việc xả lũ của các đập thủy điện,","Nói chung, vào huyện Hưng Nguyên nói riêng, kết hợp với việc xả lũ của các đập thủy điện,","Nói chung, vào huyện Hưng Nguyên nói riêng, kết hợp với việc xả lũ của các đập thủy điện,",OK,HIGH
qKL4b0D_Z5U,21,105.5999984741211,108.5999984741211,3.0,đã gây ra ngập úng trên địa bàn toàn huyện.,đã gây ra ngập úng trên địa bàn toàn huyện.,đã gây ra ngập úng trên địa bàn toàn huyện.,OK,HIGH
qKL4b0D_Z5U,22,108.5999984741211,113.5999984741211,5.0,Nước đang rút dần và người dân đang nỗ lực hết sức để có thể sớm trở lại với cuộc sống thường nhật.,Nước đang rút dần và người dân đang nỗ lực hết sức để có thể sớm trở lại với cuộc sống thường nhật.,Nước đang rút dần và người dân đang nỗ lực hết sức để có thể sớm trở lại với cuộc sống thường nhật.,OK,HIGH
qKL4b0D_Z5U,23,117.5999984741211,121.5999984741211,4.0,"Năm ngày trôi qua, nhiều xã ở Hưng Nguyên vẫn ngập nặng.","Năm ngày trôi qua, nhiều xã ở Hưng Nguyên vẫn ngập nặng.","Năm ngày trôi qua, nhiều xã ở Hưng Nguyên vẫn ngập nặng.",OK,HIGH
qKL4b0D_Z5U,24,121.5999984741211,123.5999984741211,2.0,Chỉ có đi thuyền thì mới tiếp cận được.,Chỉ có đi thuyền thì mới tiếp cận được.,Chỉ có đi thuyền thì mới tiếp cận được.,OK,HIGH
qKL4b0D_Z5U,25,123.5999984741211,125.5999984741211,2.0,Nhà anh sinh là ngập sâu nhất.,Nhà anh sinh là ngập sâu nhất.,Nhà anh sinh là ngập sâu nhất.,OK,HIGH
qKL4b0D_Z5U,26,125.5999984741211,131.60000610351562,6.000007629394531,"Nghe nói cơn bão số 10 lại sắp tới, anh lại kê cá đổ vật thêm vài bên gạch cho chắc ăn.","Nghe nói cơn bão số 10 lại sắp tới, anh lại kê cá đổ vật thêm vài bên gạch cho chắc ăn.","Nghe nói cơn bão số 10 lại sắp tới, anh lại kê cá đổ vật thêm vài bên gạch cho chắc ăn.",OK,HIGH
qKL4b0D_Z5U,27,131.60000610351562,136.60000610351562,5.0,"Chiếc tủ lạnh, vật đắt giá nhất trong nhà, cũng được kê ở chỗ cao nhất cho an tâm.","Chiếc tủ lạnh, vật đắt giá nhất trong nhà, cũng được kê ở chỗ cao nhất cho an tâm.","Chiếc tủ lạnh, vật đắt giá nhất trong nhà, cũng được kê ở chỗ cao nhất cho an tâm.",OK,HIGH
qKL4b0D_Z5U,28,153.60000610351562,157.60000610351562,4.0,"Câu chuyện từ hộ gia đình anh sinh đã mô tả câu chuyện cho cả xã Hưng Lợi này,","Câu chuyện từ hộ gia đình anh sinh đã mô tả câu chuyện cho cả xã Hưng Lợi này,","Câu chuyện từ hộ gia đình anh sinh đã mô tả câu chuyện cho cả xã Hưng Lợi này,",OK,HIGH
qKL4b0D_Z5U,29,157.60000610351562,159.60000610351562,2.0,cũng như là cả 6 thôn.,cũng như là cả 6 thôn.,cũng như là cả 6 thôn.,OK,HIGH
qKL4b0D_Z5U,30,159.60000610351562,161.60000610351562,2.0,Mọi người thì đang trong tình cảnh như thế này.,Mọi người thì đang trong tình cảnh như thế này.,Mọi người thì đang trong tình cảnh như thế này.,OK,HIGH
qKL4b0D_Z5U,31,161.60000610351562,169.60000610351562,8.0,"Và thưa quý vị, đây là khu vực nuôi trồng thủy sản, cũng như là nuôi gà, nuôi vịt của gia đình anh sinh.","Và thưa quý vị, đây là khu vực nuôi trồng thủy sản, cũng như là nuôi gà, nuôi vịt của gia đình anh sinh.","Và thưa quý vị, đây là khu vực nuôi trồng thủy sản, cũng như là nuôi gà, nuôi vịt của gia đình anh sinh.",OK,HIGH
qKL4b0D_Z5U,32,169.60000610351562,172.60000610351562,3.0,Và quý vị có thể thấy là nước ngập bẫn sâu.,Và quý vị có thể thấy là nước ngập bẫn sâu.,Và quý vị có thể thấy là nước ngập bẫn sâu.,OK,HIGH
qKL4b0D_Z5U,33,172.60000610351562,175.60000610351562,3.0,Ngoài kia cả một màu nước lũ thủ trắng xóa.,Ngoài kia cả một màu nước lũ thủ trắng xóa.,Ngoài kia cả một màu nước lũ thủ trắng xóa.,OK,HIGH
qKL4b0D_Z5U,34,175.60000610351562,177.60000610351562,2.0,Và tất cả thì đã mất trắng hết rồi.,Và tất cả thì đã mất trắng hết rồi.,Và tất cả thì đã mất trắng hết rồi.,OK,HIGH
qKL4b0D_Z5U,35,177.60000610351562,183.6000061035156,5.999999999999972,Và tổng diện tích thiệt hại về cây trồng cũng như là nuôi thủy hải sản của xã Hưng Lợi là 220 hectare.,Và tổng diện tích thiệt hại về cây trồng cũng như là nuôi thủy hải sản của xã Hưng Lợi là 220 hectare.,Và tổng diện tích thiệt hại về cây trồng cũng như là nuôi thủy hải sản của xã Hưng Lợi là 220 hectare.,OK,HIGH
qKL4b0D_Z5U,36,184.6000061035156,189.6000061035156,5.0,"Nhiều nhà khu vực cao hơn, nước rút nhanh thì cũng đang tranh thủ dọn dẹp lại đồ đặc.","Nhiều nhà khu vực cao hơn, nước rút nhanh thì cũng đang tranh thủ dọn dẹp lại đồ đặc.","Nhiều nhà khu vực cao hơn, nước rút nhanh thì cũng đang tranh thủ dọn dẹp lại đồ đặc.",OK,HIGH
qKL4b0D_Z5U,37,189.6000061035156,191.6000061035156,2.0,Khu bếp nhà bà Quý bị ngập sâu.,Khu bếp nhà bà Quý bị ngập sâu.,Khu bếp nhà bà Quý bị ngập sâu.,OK,HIGH
qKL4b0D_Z5U,38,191.6000061035156,195.6000061035156,4.0,Bà chỉ mong ước là nước rút nhanh để sớm có được nước sạch mà dùng.,Bà chỉ mong ước là nước rút nhanh để sớm có được nước sạch mà dùng.,Bà chỉ mong ước là nước rút nhanh để sớm có được nước sạch mà dùng.,OK,HIGH
qKL4b0D_Z5U,39,195.6000061035156,198.6000061035156,3.0,Nhưng chả biết mong mỏi đơn giản ấy bao giờ mới đến.,Nhưng chả biết mong mỏi đơn giản ấy bao giờ mới đến.,Nhưng chả biết mong mỏi đơn giản ấy bao giờ mới đến.,OK,HIGH
qKL4b0D_Z5U,40,214.6000061035156,220.6000061035156,6.0,"Hai ngày nay lực lượng quân đội đã tiếp cận được một số khu vực ngoài đê đã thoát lụt và tiến hành vệ sinh,","Hai ngày nay lực lượng quân đội đã tiếp cận được một số khu vực ngoài đê đã thoát lụt và tiến hành vệ sinh,","Hai ngày nay lực lượng quân đội đã tiếp cận được một số khu vực ngoài đê đã thoát lụt và tiến hành vệ sinh,",OK,HIGH
qKL4b0D_Z5U,41,220.6000061035156,222.6000061035156,2.0,dọn dẹp cơ sở vật chất cho các xã.,dọn dẹp cơ sở vật chất cho các xã.,dọn dẹp cơ sở vật chất cho các xã.,OK,HIGH
qKL4b0D_Z5U,42,222.6000061035156,226.6000061035156,4.0,Nhiều xã vẫn mất điện nên công tác vệ sinh vẫn làm bằng sức người là chính.,Nhiều xã vẫn mất điện nên công tác vệ sinh vẫn làm bằng sức người là chính.,Nhiều xã vẫn mất điện nên công tác vệ sinh vẫn làm bằng sức người là chính.,OK,HIGH
qKL4b0D_Z5U,43,227.6000061035156,229.6000061035156,2.0,Nếu mất rơi không mưa thì nước sẽ rút.,Nếu mất rơi không mưa thì nước sẽ rút.,Nếu mất rơi không mưa thì nước sẽ rút.,OK,HIGH
qKL4b0D_Z5U,44,229.6000061035156,234.6000061035156,5.0,"Sau đó quý bán xã sẽ tiến hành chỉ đào tất cả các xã,","Sau đó quý bán xã sẽ tiến hành chỉ đào tất cả các xã,","Sau đó quý bán xã sẽ tiến hành chỉ đào tất cả các xã,",OK,HIGH
qKL4b0D_Z5U,45,234.6000061035156,239.6000061035156,5.0,ban toàn xã tiến hành tổng dọn vệ sinh môi trường và khắc phục ổn định cuộc sống.,ban toàn xã tiến hành tổng dọn vệ sinh môi trường và khắc phục ổn định cuộc sống.,ban toàn xã tiến hành tổng dọn vệ sinh môi trường và khắc phục ổn định cuộc sống.,OK,HIGH
qKL4b0D_Z5U,46,240.6000061035156,242.6000061035156,2.0,Những sân trường vắng bóng học trò.,Những sân trường vắng bóng học trò.,Những sân trường vắng bóng học trò.,OK,HIGH
qKL4b0D_Z5U,47,242.6000061035156,246.6000061035156,4.0,Toàn bộ học sinh của huyện Hưng Nguyên đã phải nghỉ học từ thứ 5 tuần trước.,Toàn bộ học sinh của huyện Hưng Nguyên đã phải nghỉ học từ thứ 5 tuần trước.,Toàn bộ học sinh của huyện Hưng Nguyên đã phải nghỉ học từ thứ 5 tuần trước.,OK,HIGH
qKL4b0D_Z5U,48,246.6000061035156,249.6000061035156,3.0,"Học sinh thì có thể nghỉ, thế nhưng giáo viên thì không.","Học sinh thì có thể nghỉ, thế nhưng giáo viên thì không.","Học sinh thì có thể nghỉ, thế nhưng giáo viên thì không.",OK,HIGH
qKL4b0D_Z5U,49,250.6000061035156,253.6000061035156,3.0,"Tình hình lù lụt rất cao nhưng các cô vẫn không ngừng nghỉ,","Tình hình lù lụt rất cao nhưng các cô vẫn không ngừng nghỉ,","Tình hình lù lụt rất cao nhưng các cô vẫn không ngừng nghỉ,",OK,HIGH
qKL4b0D_Z5U,50,253.6000061035156,259.6000061035156,6.000000000000028,ngay nào cũng đến trường và trực chiến và thăm dò tình hình lù lụt rất cao như thế nào,ngay nào cũng đến trường và trực chiến và thăm dò tình hình lù lụt rất cao như thế nào,ngay nào cũng đến trường và trực chiến và thăm dò tình hình lù lụt rất cao như thế nào,OK,HIGH
qKL4b0D_Z5U,51,259.6000061035156,264.6000061035156,5.0,"và khắc phục theo hình thức quần chiều, đến đâu là dọn đến đó.","và khắc phục theo hình thức quần chiều, đến đâu là dọn đến đó.","và khắc phục theo hình thức quần chiều, đến đâu là dọn đến đó.",OK,HIGH
qKL4b0D_Z5U,52,265.6000061035156,269.6000061035156,4.0,Những đứa trẻ lớn lên ở vùng lũ giờ cũng chỉ biết chơi với nước cho qua ngày.,Những đứa trẻ lớn lên ở vùng lũ giờ cũng chỉ biết chơi với nước cho qua ngày.,Những đứa trẻ lớn lên ở vùng lũ giờ cũng chỉ biết chơi với nước cho qua ngày.,OK,HIGH
qKL4b0D_Z5U,53,270.6000061035156,273.6000061035156,3.0,Có lẽ chúng là những người lạc quan và hồn nhân nhất,Có lẽ chúng là những người lạc quan và hồn nhân nhất,Có lẽ chúng là những người lạc quan và hồn nhân nhất,OK,HIGH
qKL4b0D_Z5U,54,273.6000061035156,276.6000061035156,3.0,khi vẫn tươi giói mặc cho nước lũ vẫn mênh mông ngoài kia.,khi vẫn tươi giói mặc cho nước lũ vẫn mênh mông ngoài kia.,khi vẫn tươi giói mặc cho nước lũ vẫn mênh mông ngoài kia.,OK,HIGH
qKL4b0D_Z5U,55,283.6000061035156,285.6000061035156,2.0,Hãy subscribe cho kênh Ghiền Mì Gõ Để không bỏ lỡ những video hấp dẫn,Hãy subscribe cho kênh Ghiền Mì Gõ Để không bỏ lỡ những video hấp dẫn,Hãy subscribe cho kênh Ghiền Mì Gõ Để không bỏ lỡ những video hấp dẫn,OK,HIGH
