video_id,segment_id,start,end,duration,text_whisper,text_clean,text_final,review_decision,quality_level
DKdXnaTxwn0,0,0.0,7.360000133514404,7.360000133514404,"Sau đợt ngập lụt trên diện rộng, giờ đây nhiều đoạn bờ biển ở thành phố Nha Trang lại phải hứng chịu cảnh rác phủ kín bờ.","Sau đợt ngập lụt trên diện rộng, nhiều đoạn bờ biển ở thành phố Nha Trang hiện đang bị rác phủ kín, chủ yếu là cây mục từ nước lụt trên sông Cái đổ ra biển, khiến cho hơn 5 km bờ biển dọc theo tuyến đường Trần Phú liên tục bị ô nhiễm trong 3 ngày qua.","Sau đợt ngập lụt trên diện rộng, giờ đây nhiều đoạn bờ biển ở thành phố Nha Trang lại phải hứng chịu cảnh rác phủ kín bờ.",REVERT,HIGH
DKdXnaTxwn0,1,7.360000133514404,13.039999961853027,5.679999828338623,"Rác mà phần lớn là cây mục theo nước lụt trên sông Cái, Nha Trang đổ ra biển.","Rác, chủ yếu là cây mục từ nước lụt trên sông Cái, Nha Trang, đã đổ ra biển, khiến cho hơn 5km bờ biển dọc theo tuyến đường Trần Phú bị phủ kín rác trong suốt 3 ngày qua.","Rác mà phần lớn là cây mục theo nước lụt trên sông Cái, Nha Trang đổ ra biển.",REVERT,LOW
DKdXnaTxwn0,2,13.039999961853027,21.600000381469727,8.5600004196167,"Sóng biển lại đẩy rác lên bờ, khiến cho hơn 5km bờ biển dọc theo tuyến đường Trần Phú từ 3 ngày qua liên tục bị phủ đầy rác.","Sóng biển tiếp tục đẩy rác lên bờ, khiến hơn 5km bờ biển dọc theo tuyến đường Trần Phú ở thành phố Nha Trang từ 3 ngày qua liên tục bị phủ đầy rác.","Sóng biển lại đẩy rác lên bờ, khiến cho hơn 5km bờ biển dọc theo tuyến đường Trần Phú từ 3 ngày qua liên tục bị phủ đầy rác.",REVERT,HIGH
DKdXnaTxwn0,3,21.600000381469727,29.040000915527344,7.440000534057617,"3 ngày qua, Công ty môi trường đô thị Nha Trang đã tổ chức lực lượng công nhân cũng như phương tiện tập trung thu dọn rác trên vãi biển liên tục cả ngày.","Trong 3 ngày qua, Công ty Môi trường đô thị Nha Trang đã huy động lực lượng công nhân và phương tiện để thu dọn rác trên bãi biển, nơi bị phủ kín bởi rác do nước lũ từ sông Cái đổ ra biển và sóng biển đẩy lên.","3 ngày qua, Công ty môi trường đô thị Nha Trang đã tổ chức lực lượng công nhân cũng như phương tiện tập trung thu dọn rác trên vãi biển liên tục cả ngày.",REVERT,MEDIUM
DKdXnaTxwn0,4,29.1200008392334,31.920000076293945,2.799999237060547,Mỗi ca làm việc duy trì tối thiểu là 50 công nhân.,Mỗi ca làm việc của Công ty môi trường đô thị Nha Trang duy trì tối thiểu 50 công nhân.,Mỗi ca làm việc duy trì tối thiểu là 50 công nhân.,REVERT,HIGH
DKdXnaTxwn0,5,31.920000076293945,37.52000045776367,5.600000381469727,"Khó khăn lúc này là cư hễ thu dọn hết chỗ rác này, thì sóng biển lại đưa lên bờ chỗ rác khác.","Khó khăn hiện tại là khi thu dọn hết chỗ rác này, sóng biển lại tiếp tục đưa lên bờ những chỗ rác khác.","Khó khăn hiện tại là khi thu dọn hết chỗ rác này, sóng biển lại tiếp tục đưa lên bờ những chỗ rác khác.",OK,HIGH
DKdXnaTxwn0,6,37.52000045776367,41.52000045776367,4.0,"Vì vậy, khó có thể tính được lượng rác cần phải thu dọn ở bãi biển Nha Trang,","Khó có thể xác định lượng rác cần thu dọn tại bãi biển Nha Trang, do sóng biển liên tục đưa rác lên bờ sau đợt ngập lụt.","Vì vậy, khó có thể tính được lượng rác cần phải thu dọn ở bãi biển Nha Trang,",REVERT,LOW
DKdXnaTxwn0,7,41.52000045776367,45.52000045776367,4.0,cũng như khó dự tính đến khi nào mới có thể kết thúc công việc này.,Khó có thể xác định lượng rác cần thu dọn ở bãi biển Nha Trang cũng như thời gian kết thúc công việc này.,cũng như khó dự tính đến khi nào mới có thể kết thúc công việc này.,REVERT,LOW
