id,start,end,duration,text_len,text,video_id
0,0.0,8.0,8.0,121,"Những ngày qua trên địa bàn của tỉnh Quảng Ngãi xảy ra một số vụ rông xét đánh làm nhiều người bị thương, cây cối ngã đổ.",1HwS5KAgaqQ
1,8.0,12.0,4.0,97,Rông xét đánh thì rất nguy hiểm nhưng mà hiện nay nhiều người cũng chưa có kỹ năng để phòng ngừa.,1HwS5KAgaqQ
2,15.0,21.0,6.0,102,"Ngày 28 tháng 4, Trung tâm Y tế huyện Ba Tơ đang tập trung điều trị 4 người dân bị thương do xét đánh.",1HwS5KAgaqQ
3,21.0,29.0,8.0,136,Trước đó những người dân trên đang khai thác keo tại khu vực núi xã Ba Tô huyện Ba Tơ thì bị xét trong cơn mưa rông đánh chúng bất tỉnh.,1HwS5KAgaqQ
4,30.0,43.0,13.0,100,Thời gian gần đây trên địa bàn Quảng Ngãi xảy ra nhiều vụ lốc xoáy và xấm xét làm sập nhiều nhà dân.,1HwS5KAgaqQ
5,43.0,51.0,8.0,153,Theo Trung tâm Dự báo khí tượng Thủy văn Quảng Ngãi thì thời điểm này đang vào lúc giao mùa nên hiện tượng rông xét đang diễn biến phức tạp và nguy hiểm.,1HwS5KAgaqQ
6,60.0,88.0,28.0,56,Hiện tượng rông xét sẽ còn kéo dài trong những ngày tới.,1HwS5KAgaqQ
7,88.0,98.0,10.0,158,Người dân đặc biệt là bà con nông dân không nên chủ quan trước rông xét và phải nắm rõ các biện pháp phòng tránh rông xét gây thương vong về người và tài sản.,1HwS5KAgaqQ
