video_id,segment_id,start,end,duration,text_whisper,text_clean,text_final,review_decision,quality_level
CD4OyqzLjw8,47,314.239990234375,319.8399963378906,5.600006103515625,Bởi vùng đất nơi họ sân ra từ bao đời này đã luôn phải gắn kiều những khắc nghiệp của thời tiết.,Bởi vùng đất nơi họ sinh ra từ bao đời nay đã luôn phải gắn liền với những khắc nghiệt của thời tiết.,Bởi vùng đất nơi họ sinh ra từ bao đời nay đã luôn phải gắn liền với những khắc nghiệt của thời tiết.,OK,HIGH
CD4OyqzLjw8,48,322.3599853515625,331.8399963378906,9.480010986328125,Bộ trưởng Môi trường Liên bang Ấn Độ ngày hôm qua cho biết là nước này đang xem xét kế hoạch giảm 20-30% nồng độ bụi mịn trong nỗ lực giảm ô nhiễm không khí.,Bộ trưởng Môi trường Liên bang Ấn Độ ngày hôm qua cho biết nước này đang xem xét kế hoạch giảm 20-30% nồng độ bụi mịn nhằm nỗ lực giảm ô nhiễm không khí.,Bộ trưởng Môi trường Liên bang Ấn Độ ngày hôm qua cho biết nước này đang xem xét kế hoạch giảm 20-30% nồng độ bụi mịn nhằm nỗ lực giảm ô nhiễm không khí.,OK,HIGH
CD4OyqzLjw8,49,331.8399963378906,341.8399963378906,10.0,"Theo đó, thông qua chương trình Không khí sạch quốc gia, Bộ Môi trưởng Ấn Độ đang áp dụng phương pháp tiếp cận tổng thể nhằm giảm ô nhiễm không khí tại 122 thành phố trên cả nước.","Theo Bộ Môi trường Ấn Độ, thông qua chương trình Không khí sạch quốc gia, nước này đang áp dụng phương pháp tiếp cận tổng thể nhằm giảm ô nhiễm không khí tại 122 thành phố trên toàn quốc, với mục tiêu giảm 20-30% nồng độ bụi mịn.","Theo đó, thông qua chương trình Không khí sạch quốc gia, Bộ Môi trưởng Ấn Độ đang áp dụng phương pháp tiếp cận tổng thể nhằm giảm ô nhiễm không khí tại 122 thành phố trên cả nước.",REVERT,HIGH
CD4OyqzLjw8,50,342.0799865722656,349.760009765625,7.680023193359375,"Từ tháng 4 vừa qua, Ấn Độ đã áp dụng các tiêu chuẩn cao hơn để kiểm soát khí thải trên toàn quốc, giảm đáng kể lượng khí thải do phương tiện giao thông.","Từ tháng 4 vừa qua, Ấn Độ đã áp dụng các tiêu chuẩn cao hơn để kiểm soát khí thải trên toàn quốc, qua đó giảm đáng kể lượng khí thải từ phương tiện giao thông.","Từ tháng 4 vừa qua, Ấn Độ đã áp dụng các tiêu chuẩn cao hơn để kiểm soát khí thải trên toàn quốc, qua đó giảm đáng kể lượng khí thải từ phương tiện giao thông.",OK,HIGH
CD4OyqzLjw8,51,349.760009765625,358.79998779296875,9.03997802734375,Số ngày có chất lượng không khí ô nhiễm trong 9 tháng đầu năm nay tại Ấn Độ đã giảm xuống 56 ngày so với 156 ngày cùng kỳ năm 2016.,"Số ngày có chất lượng không khí ô nhiễm trong 9 tháng đầu năm nay tại Ấn Độ đã giảm xuống còn 56 ngày, so với 156 ngày trong cùng kỳ năm 2016.","Số ngày có chất lượng không khí ô nhiễm trong 9 tháng đầu năm nay tại Ấn Độ đã giảm xuống còn 56 ngày, so với 156 ngày trong cùng kỳ năm 2016.",OK,HIGH
CD4OyqzLjw8,52,358.79998779296875,366.8800048828125,8.08001708984375,Ô nhiễm môi trường tại Ấn Độ chủ yếu là do khí thải từ các phương tiện giao thông và hoạt động công nghệ bụi từ các công trường quản lý rác thải yếu kém.,Ô nhiễm môi trường tại Ấn Độ chủ yếu do khí thải từ các phương tiện giao thông và bụi từ các công trường quản lý rác thải kém.,Ô nhiễm môi trường tại Ấn Độ chủ yếu do khí thải từ các phương tiện giao thông và bụi từ các công trường quản lý rác thải kém.,OK,HIGH
CD4OyqzLjw8,53,366.8800048828125,374.1600036621094,7.279998779296875,"Việc đốt, giảm dạ đặc biệt là do các yếu tố địa lý và khí tượng khu vực phía Bắc Ấn Độ ô nhiễm không khí nghiêm trọng vào mùa đông.","Việc đốt và giảm dạ, đặc biệt là do các yếu tố địa lý và khí tượng, đã khiến khu vực phía Bắc Ấn Độ chịu ô nhiễm không khí nghiêm trọng vào mùa đông.","Việc đốt và giảm dạ, đặc biệt là do các yếu tố địa lý và khí tượng, đã khiến khu vực phía Bắc Ấn Độ chịu ô nhiễm không khí nghiêm trọng vào mùa đông.",OK,HIGH
