video_id,segment_id,start,end,duration,text_whisper,text_clean,text_final,review_decision,quality_level
ZWnOCmuNR2M,0,0.0,3.0,3.0,Bây giờ sẽ là những thông tin dự báo thời tiết.,Bây giờ sẽ là những thông tin dự báo thời tiết.,Bây giờ sẽ là những thông tin dự báo thời tiết.,OK,HIGH
ZWnOCmuNR2M,1,3.0,6.0,3.0,"Chị Hải Yên, mời chị cập nhật thông tin mới nhất về áp thấp nhiệt đới.","Chị Hải Yên, xin mời chị cập nhật thông tin mới nhất về áp thấp nhiệt đới.","Chị Hải Yên, xin mời chị cập nhật thông tin mới nhất về áp thấp nhiệt đới.",OK,HIGH
ZWnOCmuNR2M,2,6.0,10.0,4.0,"Vâng ạ, như cập nhật ở phần đầu của chương trình, áp thấp nhiệt đới chiều nay đã đi vào khu vực Biển Đông rồi.","Chiều nay, áp thấp nhiệt đới đã đi vào khu vực Biển Đông và có khả năng mạnh lên thành bão, di chuyển vào khu vực Nam Trung Bộ.","Vâng ạ, như cập nhật ở phần đầu của chương trình, áp thấp nhiệt đới chiều nay đã đi vào khu vực Biển Đông rồi.",REVERT,HIGH
ZWnOCmuNR2M,3,10.0,15.0,5.0,Và nó có khả năng là mạnh lên thành bão với hướng di chuyển vào khu vực Nam của Trung Bộ.,Áp thấp nhiệt đới có khả năng mạnh lên thành bão và di chuyển vào khu vực Nam của Trung Bộ.,Áp thấp nhiệt đới có khả năng mạnh lên thành bão và di chuyển vào khu vực Nam của Trung Bộ.,OK,HIGH
ZWnOCmuNR2M,4,15.0,20.0,5.0,Và cụ thể với đường đi của cơn áp thấp nhiệt đới này như thế nào thì ngay bây giờ tôi sẽ cập nhật đến Anh Dương và quý vị khán giả.,"Ngay bây giờ, tôi sẽ cập nhật đến Anh Dương và quý vị khán giả về đường đi của cơn áp thấp nhiệt đới, đã đi vào khu vực Biển Đông chiều nay và có khả năng mạnh lên thành bão, với hướng di chuyển vào khu vực Nam Trung Bộ.",Và cụ thể với đường đi của cơn áp thấp nhiệt đới này như thế nào thì ngay bây giờ tôi sẽ cập nhật đến Anh Dương và quý vị khán giả.,REVERT,HIGH
ZWnOCmuNR2M,5,20.0,29.0,9.0,"Thưa quý vị, trong đêm nay và ngày mai thì áp thấp nhiệt đới sẽ đi với bất tốc nhanh là từ 25 đến 30 km một giờ và hướng theo phía Tây.","Thưa quý vị, trong đêm nay và ngày mai, áp thấp nhiệt đới sẽ di chuyển với tốc độ nhanh từ 25 đến 30 km/h theo hướng Tây.","Thưa quý vị, trong đêm nay và ngày mai, áp thấp nhiệt đới sẽ di chuyển với tốc độ nhanh từ 25 đến 30 km/h theo hướng Tây.",OK,HIGH
ZWnOCmuNR2M,6,29.0,39.0,10.0,"Đến 13 giờ ngày mai, ngày 9 tháng 11 thì tâm bão còn cách đảo sông Tử Tây khoảng là 170 km về phía Tây Bắc với cứng độ bão mạnh cấp 8, giật cấp 10.","Đến 13 giờ ngày mai, 9 tháng 11, tâm bão sẽ còn cách đảo Sông Tử Tây khoảng 170 km về phía Tây Bắc, với cường độ bão mạnh cấp 8, giật cấp 10.","Đến 13 giờ ngày mai, 9 tháng 11, tâm bão sẽ còn cách đảo Sông Tử Tây khoảng 170 km về phía Tây Bắc, với cường độ bão mạnh cấp 8, giật cấp 10.",OK,HIGH
ZWnOCmuNR2M,7,39.0,44.0,5.0,Sau đó thì bão sẽ di chuyển hướng về khu vực vùng biển từ Phú Yên đến Ninh Thuận.,"Sau đó, bão sẽ di chuyển về khu vực vùng biển từ Phú Yên đến Ninh Thuận.","Sau đó, bão sẽ di chuyển về khu vực vùng biển từ Phú Yên đến Ninh Thuận.",OK,HIGH
ZWnOCmuNR2M,8,44.0,52.0,8.0,"Trước mắt là trong đêm nay và ngày mai, hoàn lưu của nó chủ yếu là gây thời tiết xấu trên biển và các tàu thuyền hoạt động trong vùng nguy hiểm này","Trong đêm nay và ngày mai, hoàn lưu của áp thấp nhiệt đới sẽ chủ yếu gây thời tiết xấu trên biển, vì vậy các tàu thuyền hoạt động trong vùng nguy hiểm này cần nhanh chóng di chuyển để tránh rủi ro.","Trong đêm nay và ngày mai, hoàn lưu của áp thấp nhiệt đới sẽ chủ yếu gây thời tiết xấu trên biển, vì vậy các tàu thuyền hoạt động trong vùng nguy hiểm này cần nhanh chóng di chuyển để tránh rủi ro.",OK,HIGH
ZWnOCmuNR2M,9,52.0,55.0,3.0,"thì cần phải nhanh chóng di chuyển tranh trú, thoát khỏi vùng nguy hiểm.","Các tàu thuyền hoạt động trong vùng nguy hiểm này cần nhanh chóng di chuyển vào nơi trú ẩn, thoát khỏi khu vực từ vĩ tuyến 11 đến vĩ tuyến 15 độ Bắc và từ kinh tuyến 112 đến kinh tuyến 120 độ Đông.","thì cần phải nhanh chóng di chuyển tranh trú, thoát khỏi vùng nguy hiểm.",REVERT,LOW
ZWnOCmuNR2M,10,55.0,63.0,8.0,Đó là từ vĩ tuyến 11 đến vĩ tuyến 15 độ Bắc và từ kinh tuyến 112 đến kinh tuyến 120 độ Đồng.,Khu vực ảnh hưởng của áp thấp nhiệt đới nằm từ vĩ tuyến 11 đến vĩ tuyến 15 độ Bắc và từ kinh tuyến 112 đến kinh tuyến 120 độ Đông.,Khu vực ảnh hưởng của áp thấp nhiệt đới nằm từ vĩ tuyến 11 đến vĩ tuyến 15 độ Bắc và từ kinh tuyến 112 đến kinh tuyến 120 độ Đông.,OK,HIGH
ZWnOCmuNR2M,11,63.0,69.0,6.0,Đến chiều tối mai thì hoàn lưu bão mới bắt đầu tác động đến thời tiết trên đất liền gây mưa to cho khu vực.,"Đến chiều tối mai, hoàn lưu bão sẽ bắt đầu tác động đến thời tiết trên đất liền, gây mưa to cho khu vực từ Đà Nẵng đến Bình Thuận.",Đến chiều tối mai thì hoàn lưu bão mới bắt đầu tác động đến thời tiết trên đất liền gây mưa to cho khu vực.,REVERT,HIGH
ZWnOCmuNR2M,12,69.0,78.0,9.0,Từ Đà Nẵng trở xuống đến Bình Thuận và sang đến ngày 10 tháng 11 thì mưa sẽ rồn rập hơn với lượng mưa có thể lên tới hàng trăm mm,"Từ Đà Nẵng đến Bình Thuận, bắt đầu từ ngày 10 tháng 11, mưa sẽ rồn rập hơn với lượng mưa có thể đạt tới hàng trăm mm.","Từ Đà Nẵng đến Bình Thuận, bắt đầu từ ngày 10 tháng 11, mưa sẽ rồn rập hơn với lượng mưa có thể đạt tới hàng trăm mm.",OK,HIGH
ZWnOCmuNR2M,13,78.0,83.0,5.0,tập trung tại khu vực từ Thừa Thiên Huế đến Khánh Hòa và cả khu vực Tây Nguyên.,"Mưa lớn sẽ tập trung tại khu vực từ Thừa Thiên Huế đến Khánh Hòa và cả khu vực Tây Nguyên, với lượng mưa có thể lên tới hàng trăm mm vào ngày 10 tháng 11.",tập trung tại khu vực từ Thừa Thiên Huế đến Khánh Hòa và cả khu vực Tây Nguyên.,REVERT,HIGH
ZWnOCmuNR2M,14,83.0,91.0,8.0,Đến ngày 11 tháng 11 thì vùng mưa lớn sẽ dịch chuyển dần lên phía Bắc tập trung từ Quảng Bình trở xuống đến Quảng Ngãi.,"Đến ngày 11 tháng 11, vùng mưa lớn sẽ dần dịch chuyển lên phía Bắc, tập trung từ Quảng Bình đến Quảng Ngãi.","Đến ngày 11 tháng 11, vùng mưa lớn sẽ dần dịch chuyển lên phía Bắc, tập trung từ Quảng Bình đến Quảng Ngãi.",OK,HIGH
ZWnOCmuNR2M,15,91.0,98.0,7.0,"Ngay từ bây giờ bà con nên có kế hoạch ứng phó với mưa lũ, cất giữ giấy tờ tài liệu quan trọng trong túi không thấm nước,","Ngay từ bây giờ, bà con cần có kế hoạch ứng phó với mưa lũ, cất giữ giấy tờ và tài liệu quan trọng trong túi không thấm nước, chuẩn bị lương thực, nhu yếu phẩm, bếp di động như bếp cồn, bếp ca du lịch để sẵn sàng cho tình huống ngập lụt kéo dài ít nhất 1 tuần.","Ngay từ bây giờ bà con nên có kế hoạch ứng phó với mưa lũ, cất giữ giấy tờ tài liệu quan trọng trong túi không thấm nước,",REVERT,HIGH
ZWnOCmuNR2M,16,98.0,104.0,6.0,"chuẩn bị lương thực, nhu yếu phẩm, bếp di động như bếp cồn, bếp ca du lịch trong trường hợp ngập lụt ít nhất 1 tuần.","Bà con nên chuẩn bị lương thực, nhu yếu phẩm, bếp di động như bếp cồn, bếp ca du lịch trong trường hợp ngập lụt kéo dài ít nhất 1 tuần.","Bà con nên chuẩn bị lương thực, nhu yếu phẩm, bếp di động như bếp cồn, bếp ca du lịch trong trường hợp ngập lụt kéo dài ít nhất 1 tuần.",OK,HIGH
ZWnOCmuNR2M,17,104.0,110.0,6.0,"Và đừng quên các vật dụng dùng trong trường hợp khẩn cấp đó là áo phao, đèn pin và pin dự phòng.","Đừng quên chuẩn bị các vật dụng cần thiết trong trường hợp khẩn cấp như áo phao, đèn pin và pin dự phòng.","Đừng quên chuẩn bị các vật dụng cần thiết trong trường hợp khẩn cấp như áo phao, đèn pin và pin dự phòng.",OK,HIGH
ZWnOCmuNR2M,18,110.0,114.0,4.0,Và cuối cùng sẽ là phần dự báo thời tiết cho các thành phố trong đêm nay và ngày mai.,"Cuối cùng, chúng tôi xin gửi đến quý vị phần dự báo thời tiết cho các thành phố trong đêm nay và ngày mai.","Cuối cùng, chúng tôi xin gửi đến quý vị phần dự báo thời tiết cho các thành phố trong đêm nay và ngày mai.",OK,HIGH
ZWnOCmuNR2M,19,114.0,121.0,7.0,"Thành phố Đà Nẵng trước khi có mưa nặng hạt vào chiều tối mai, đêm nay và sáng mai mưa nhỏ, trời chủ yếu là nhiều mây,","Thành phố Đà Nẵng sẽ có mưa nhỏ vào đêm nay và sáng mai, trước khi xuất hiện mưa nặng hạt vào chiều tối mai, trời chủ yếu nhiều mây và se lạnh, với nhiệt độ thấp nhất là 22 độ C và cao nhất là 28 độ C.","Thành phố Đà Nẵng trước khi có mưa nặng hạt vào chiều tối mai, đêm nay và sáng mai mưa nhỏ, trời chủ yếu là nhiều mây,",REVERT,MEDIUM
ZWnOCmuNR2M,20,121.0,126.0,5.0,"trời xe lạnh, nhiệt độ thấp nhất là 22 độ, chưa mai tăng lên 28 độ.","Trời se lạnh, nhiệt độ thấp nhất là 22 độ, ngày mai sẽ tăng lên 28 độ.","Trời se lạnh, nhiệt độ thấp nhất là 22 độ, ngày mai sẽ tăng lên 28 độ.",OK,HIGH
ZWnOCmuNR2M,21,126.0,130.0,4.0,"Thành phố Hồ Chí Minh đêm nay ít mưa, trời mát khoảng là 25 độ,","Thành phố Hồ Chí Minh đêm nay ít mưa, trời mát với nhiệt độ khoảng 25 độ, ngày mai trời nắng nhiều, nhiệt độ cao nhất đạt 33 độ, chiều tối có mưa vài nơi.","Thành phố Hồ Chí Minh đêm nay ít mưa, trời mát khoảng là 25 độ,",REVERT,HIGH
ZWnOCmuNR2M,22,130.0,136.0,6.0,"ngày mai trời nắng nhiều, nhiệt độ cao nhất là 33 độ, chiều tối mưa vài nơi và rất nhanh.","Ngày mai, thành phố Hồ Chí Minh sẽ có trời nắng nhiều, nhiệt độ cao nhất đạt 33 độ, chiều tối có khả năng mưa vài nơi và sẽ đến rất nhanh.","ngày mai trời nắng nhiều, nhiệt độ cao nhất là 33 độ, chiều tối mưa vài nơi và rất nhanh.",REVERT,HIGH
ZWnOCmuNR2M,23,136.0,141.0,5.0,"Thủ đô Hà Nội vẫn duy trì tiết trời khô giáo, đêm nay khá lạnh, nhiệt độ thấp nhất là 20 độ,","Thủ đô Hà Nội vẫn duy trì thời tiết khô ráo, đêm nay trời khá lạnh với nhiệt độ thấp nhất là 20 độ, ngày mai sẽ nắng ấm hơn với nhiệt độ tăng nhanh lên 29 độ và độ ẩm giảm xuống còn 40%.","Thủ đô Hà Nội vẫn duy trì tiết trời khô giáo, đêm nay khá lạnh, nhiệt độ thấp nhất là 20 độ,",REVERT,MEDIUM
ZWnOCmuNR2M,24,141.0,148.0,7.0,"ngày mai nắng và ấm hơn, nhiệt độ tăng nhanh lên 29 độ, độ ẩm giảm thấp 40% nên khá là hành khô.","Ngày mai, Thủ đô Hà Nội sẽ có nắng ấm hơn, nhiệt độ tăng nhanh lên 29 độ, độ ẩm giảm xuống còn 40%, khiến thời tiết khá hanh khô.","ngày mai nắng và ấm hơn, nhiệt độ tăng nhanh lên 29 độ, độ ẩm giảm thấp 40% nên khá là hành khô.",REVERT,MEDIUM
ZWnOCmuNR2M,25,156.0,158.0,2.0,Hẹn gặp lại các bạn trong những video tiếp theo!,Hẹn gặp lại quý vị trong những video tiếp theo!,Hẹn gặp lại quý vị trong những video tiếp theo!,OK,LOW
