video_id,segment_id,start,end,duration,text_whisper,text_clean,text_final,review_decision,quality_level
gNYj-H5ItuU,0,0.0,5.0,5.0,"Còn bây giờ sẽ là những thông tin dự báo thời tiết, chị Quỳnh Hoa tôi nghe nói là Hà Nội chuẩn bị đón không khí lạnh","Hà Nội chuẩn bị đón không khí lạnh, tuy nhiên hiện tại vẫn chưa lạnh lắm, thậm chí buổi trưa nay còn có nắng nóng.","Còn bây giờ sẽ là những thông tin dự báo thời tiết, chị Quỳnh Hoa tôi nghe nói là Hà Nội chuẩn bị đón không khí lạnh",REVERT,LOW
gNYj-H5ItuU,1,5.0,10.0,5.0,"và đến bây giờ thì tôi thấy vẫn chưa lạnh lắm, tậm chí là buổi trưa nay còn thấy nắng nóng nữa cơ. Cụ thể như thế nào?","Đến thời điểm hiện tại, Hà Nội vẫn chưa cảm nhận được không khí lạnh, thậm chí buổi trưa nay còn có nắng nóng.","và đến bây giờ thì tôi thấy vẫn chưa lạnh lắm, tậm chí là buổi trưa nay còn thấy nắng nóng nữa cơ. Cụ thể như thế nào?",REVERT,LOW
gNYj-H5ItuU,2,10.0,15.0,5.0,"Vâng, không khí lạnh thì chưa về đến thủ đô Hà Nội nhưng mà cũng đã bắt đầu chớm tác động đến một số nơi miền Bắc rồi",Không khí lạnh chưa về đến thủ đô Hà Nội nhưng đã bắt đầu tác động đến một số nơi ở miền Bắc.,Không khí lạnh chưa về đến thủ đô Hà Nội nhưng đã bắt đầu tác động đến một số nơi ở miền Bắc.,OK,HIGH
gNYj-H5ItuU,3,15.0,19.0,4.0,và khả năng là sang ngày mai thì anh Dương có thể cảm nhận được rõ hơn những tác động của không khí lạnh.,"Khả năng là vào ngày mai, anh Dương sẽ cảm nhận rõ hơn những tác động của không khí lạnh.","Khả năng là vào ngày mai, anh Dương sẽ cảm nhận rõ hơn những tác động của không khí lạnh.",OK,HIGH
gNYj-H5ItuU,4,19.0,25.0,6.0,Cụ thể theo diện biến của không khí lạnh thì đến chiều nay nó mới di chuyển tới khu vực vùng núi của nước ta mà thôi,"Theo diễn biến của không khí lạnh, đến chiều nay, nó mới di chuyển tới khu vực vùng núi của nước ta.","Theo diễn biến của không khí lạnh, đến chiều nay, nó mới di chuyển tới khu vực vùng núi của nước ta.",OK,HIGH
gNYj-H5ItuU,5,25.0,32.0,7.0,"và dự báo trong đêm nay ngày mai nó sẽ bắt đầu ảnh hưởng tới khu vực thủ đô Hà Nội, hầu khắp miền Bắc và xuống cả khu vực Bắc Trung Bộ.","Dự báo trong đêm nay và ngày mai, không khí lạnh sẽ bắt đầu ảnh hưởng đến khu vực thủ đô Hà Nội, hầu khắp miền Bắc và cả khu vực Bắc Trung Bộ.","Dự báo trong đêm nay và ngày mai, không khí lạnh sẽ bắt đầu ảnh hưởng đến khu vực thủ đô Hà Nội, hầu khắp miền Bắc và cả khu vực Bắc Trung Bộ.",OK,HIGH
gNYj-H5ItuU,6,32.0,39.0,7.0,Đặc điểm của đợt không khí lạnh lần này là nó mang theo những luồng gió Đông Bắc vì vậy mà ban ngày trời vẫn có nắng,"Đợt không khí lạnh lần này mang theo những luồng gió Đông Bắc, vì vậy ban ngày trời vẫn có nắng.","Đợt không khí lạnh lần này mang theo những luồng gió Đông Bắc, vì vậy ban ngày trời vẫn có nắng.",OK,HIGH
gNYj-H5ItuU,7,39.0,45.0,6.0,"và dự báo là nắng sẽ vẫn duy trì trong những ngày tới, hoàn toàn khác biệt giữa cảm giác giữa ban ngày và ban đêm.","Dự báo nắng sẽ tiếp tục duy trì trong những ngày tới, tạo ra sự khác biệt rõ rệt giữa cảm giác ban ngày và ban đêm.","Dự báo nắng sẽ tiếp tục duy trì trong những ngày tới, tạo ra sự khác biệt rõ rệt giữa cảm giác ban ngày và ban đêm.",OK,HIGH
gNYj-H5ItuU,8,45.0,51.0,6.0,Dự báo vùng Z sẽ trải rộng từ khu vực miền Bắc xuống tới cả khu vực Bắc Trung Bộ.,Dự báo vùng không khí lạnh sẽ trải rộng từ khu vực miền Bắc xuống cả khu vực Bắc Trung Bộ.,Dự báo vùng Z sẽ trải rộng từ khu vực miền Bắc xuống tới cả khu vực Bắc Trung Bộ.,REVERT,HIGH
gNYj-H5ItuU,9,52.0,61.0,9.0,"Lần đầu tiên từ đầu mùa đông đến giờ, nhiệt độ thấp nhất ở hầu khắp các thành phố các khu vực này sẽ trong khoảng 11-14 độ.","Lần đầu tiên từ đầu mùa đông đến nay, nhiệt độ thấp nhất ở hầu khắp các thành phố miền Bắc và Bắc Trung Bộ sẽ dao động trong khoảng 11-14 độ.","Lần đầu tiên từ đầu mùa đông đến giờ, nhiệt độ thấp nhất ở hầu khắp các thành phố các khu vực này sẽ trong khoảng 11-14 độ.",REVERT,HIGH
gNYj-H5ItuU,10,61.0,65.0,4.0,"Thậm chí ở những vùng núi cao, nhiệt độ có thể từ 7-10 độ.","Thậm chí, ở những vùng núi cao, nhiệt độ có thể giảm xuống từ 7 đến 10 độ.","Thậm chí ở những vùng núi cao, nhiệt độ có thể từ 7-10 độ.",REVERT,HIGH
gNYj-H5ItuU,11,65.0,69.0,4.0,Các điểm vùng núi cao hơn thì nhiệt độ có thể dưới 5 độ trời Z cóng.,Các điểm vùng núi cao có thể ghi nhận nhiệt độ dưới 5 độ trong đợt không khí lạnh này.,Các điểm vùng núi cao hơn thì nhiệt độ có thể dưới 5 độ trời Z cóng.,REVERT,LOW
gNYj-H5ItuU,12,69.0,75.0,6.0,"Vì nhiều lý do khác nhau, cứ mỗi khi trời Z thì nhiều người lại có thói quen là chúng ta dùng than tổ ong để sởi ấm.","Vì nhiều lý do khác nhau, mỗi khi trời lạnh, nhiều người lại có thói quen sử dụng than tổ ong để sưởi ấm.","Vì nhiều lý do khác nhau, mỗi khi trời lạnh, nhiều người lại có thói quen sử dụng than tổ ong để sưởi ấm.",OK,HIGH
gNYj-H5ItuU,13,75.0,81.0,6.0,"Tuy nhiên, cách làm này tiêm ẩn rất nhiều những rủi ro khi mà có thể bị ngộ độc khí CO.","Tuy nhiên, việc sử dụng than tổ ong để sưởi ấm tiềm ẩn nhiều rủi ro, có thể dẫn đến ngộ độc khí CO, ảnh hưởng nghiêm trọng đến sức khỏe, thậm chí gây tử vong, như trường hợp đã xảy ra ở Quảng Bình vào đêm qua.","Tuy nhiên, cách làm này tiêm ẩn rất nhiều những rủi ro khi mà có thể bị ngộ độc khí CO.",REVERT,LOW
gNYj-H5ItuU,14,81.0,88.0,7.0,"Và chính khí này có thể ảnh hưởng tới sức khỏe của chúng ta, thậm chí là gây tử vong như trường hợp ở Quảng Bình xảy ra đêm ngày hôm qua.","Khí CO có thể ảnh hưởng đến sức khỏe của chúng ta, thậm chí gây tử vong, như trường hợp xảy ra ở Quảng Bình vào đêm qua.","Và chính khí này có thể ảnh hưởng tới sức khỏe của chúng ta, thậm chí là gây tử vong như trường hợp ở Quảng Bình xảy ra đêm ngày hôm qua.",REVERT,HIGH
gNYj-H5ItuU,15,88.0,98.0,10.0,"Một trong những nguyên nhân khiến rủi ro này cao hơn đó là do kết cấu nhà ở hiện nay thường kín hơn ngày xưa, hạn chế sự trao đổi khí giữa bên ngoài và trong nhà.","Một trong những nguyên nhân làm tăng rủi ro ngộ độc khí CO là do kết cấu nhà ở hiện nay thường kín hơn so với trước đây, dẫn đến hạn chế sự trao đổi khí giữa bên ngoài và trong nhà.","Một trong những nguyên nhân khiến rủi ro này cao hơn đó là do kết cấu nhà ở hiện nay thường kín hơn ngày xưa, hạn chế sự trao đổi khí giữa bên ngoài và trong nhà.",REVERT,HIGH
gNYj-H5ItuU,16,98.0,107.0,9.0,"Theo các chuyên gia y tế, để hạn chế việc ngộ độc khí CO thì chúng ta không nên đốt than tổ ong, than củi hay là các nguyên liệu khác trong phòng kín.","Theo các chuyên gia y tế, để hạn chế ngộ độc khí CO, chúng ta không nên đốt than tổ ong, than củi hay các nguyên liệu khác trong phòng kín.","Theo các chuyên gia y tế, để hạn chế ngộ độc khí CO, chúng ta không nên đốt than tổ ong, than củi hay các nguyên liệu khác trong phòng kín.",OK,HIGH
gNYj-H5ItuU,17,107.0,111.0,4.0,"Nếu phải đốt thì cần phải mở rộng cửa, tạo ra những sự thoáng khí.","Nếu phải đốt than tổ ong, cần mở rộng cửa để tạo sự thông thoáng khí.","Nếu phải đốt thì cần phải mở rộng cửa, tạo ra những sự thoáng khí.",REVERT,HIGH
gNYj-H5ItuU,18,112.0,116.0,4.0,Và tiếp theo sẽ là phần dự báo chi tiết trong một số thành phố trong đêm nay và ngày mai.,Tiếp theo là phần dự báo chi tiết thời tiết cho một số thành phố trong đêm nay và ngày mai.,Tiếp theo là phần dự báo chi tiết thời tiết cho một số thành phố trong đêm nay và ngày mai.,OK,HIGH
gNYj-H5ItuU,19,116.0,120.0,4.0,"Với thủ đô Hà Nội, đêm nay trời không mưa, nhiệt độ sẽ giảm xuống ngưỡng 15 độ.","Đêm nay, thủ đô Hà Nội sẽ không có mưa, nhiệt độ giảm xuống mức 15 độ.","Đêm nay, thủ đô Hà Nội sẽ không có mưa, nhiệt độ giảm xuống mức 15 độ.",OK,HIGH
gNYj-H5ItuU,20,120.0,125.0,5.0,"Sang ngày mai, trời nắng hanh và Z khô, nhiệt độ cao nhất trong ngày là 20 độ.","Sang ngày mai, trời nắng hanh và khô, nhiệt độ cao nhất trong ngày tại vùng Z sẽ đạt 20 độ.","Sang ngày mai, trời nắng hanh và Z khô, nhiệt độ cao nhất trong ngày là 20 độ.",REVERT,MEDIUM
gNYj-H5ItuU,21,126.0,129.0,3.0,"Với thành phố Huế, đêm nay mưa Z, 19 độ.","Đêm nay, thành phố Huế có mưa và nhiệt độ là 19 độ.","Đêm nay, thành phố Huế có mưa và nhiệt độ là 19 độ.",OK,HIGH
gNYj-H5ItuU,22,129.0,134.0,5.0,"Sang ngày mai, mưa sẽ vẫn còn duy trì từng lúc, nhiệt độ cao nhất trong ngày là 25 độ.","Sang ngày mai, mưa sẽ tiếp tục xuất hiện từng lúc, với nhiệt độ cao nhất trong ngày đạt 25 độ.","Sang ngày mai, mưa sẽ tiếp tục xuất hiện từng lúc, với nhiệt độ cao nhất trong ngày đạt 25 độ.",OK,HIGH
gNYj-H5ItuU,23,135.0,138.0,3.0,"Thành phố Hồ Chí Minh đêm nay không mưa, 24 độ.","Thành phố Hồ Chí Minh đêm nay không có mưa, nhiệt độ 24 độ.","Thành phố Hồ Chí Minh đêm nay không có mưa, nhiệt độ 24 độ.",OK,HIGH
gNYj-H5ItuU,24,138.0,141.0,3.0,"Sang ngày mai trời nắng, nhiệt độ cao nhất là 32 độ.","Sang ngày mai, thành phố Hồ Chí Minh sẽ có nắng, với nhiệt độ cao nhất đạt 32 độ.","Sang ngày mai trời nắng, nhiệt độ cao nhất là 32 độ.",REVERT,HIGH
gNYj-H5ItuU,25,141.0,143.0,2.0,"Chiều tối mai, khả năng mưa vài nơi.","Chiều tối mai, Hà Nội có khả năng xuất hiện mưa vài nơi.","Chiều tối mai, khả năng mưa vài nơi.",REVERT,HIGH
gNYj-H5ItuU,26,155.0,157.0,2.0,Hãy subscribe cho kênh Ghiền Mì Gõ Để không bỏ lỡ những video hấp dẫn,Hãy đăng ký kênh Ghiền Mì Gõ để không bỏ lỡ những video hấp dẫn.,Hãy đăng ký kênh Ghiền Mì Gõ để không bỏ lỡ những video hấp dẫn.,OK,LOW
