video_id,segment_id,start,end,duration,text_whisper,text_clean,text_final,review_decision,quality_level
4aK4dzPQE7E,45,362.760009765625,367.760009765625,5.0,Tiếp theo như thường lệ sẽ là thông tin sự báo chi tiết cho một số thành phố trong đêm nay và ngày mai.,Tiếp theo như thường lệ sẽ là thông tin sự báo chi tiết cho một số thành phố trong đêm nay và ngày mai.,Tiếp theo như thường lệ sẽ là thông tin sự báo chi tiết cho một số thành phố trong đêm nay và ngày mai.,OK,HIGH
4aK4dzPQE7E,46,367.760009765625,374.760009765625,7.0,"Tại thủ đô Hà Nội đêm nay và sáng mai có sương mù, nhiệt độ thấp nhất là 16 độ. Trưa chiều mai có nắng ấm, nhiệt độ tăng lên 25 độ.","Tại thủ đô Hà Nội đêm nay và sáng mai có sương mù, nhiệt độ thấp nhất là 16 độ. Trưa chiều mai có nắng ấm, nhiệt độ tăng lên 25 độ.","Tại thủ đô Hà Nội đêm nay và sáng mai có sương mù, nhiệt độ thấp nhất là 16 độ. Trưa chiều mai có nắng ấm, nhiệt độ tăng lên 25 độ.",OK,HIGH
4aK4dzPQE7E,47,374.760009765625,381.760009765625,7.0,"Thành phố Đà Nẵng trong đêm nay không mưa, se se lạnh 20 độ. Ngày mai nắng cả ngày, nhiệt độ cao nhất khoảng 26 độ.","Thành phố Đà Nẵng trong đêm nay không mưa, se se lạnh 20 độ. Ngày mai nắng cả ngày, nhiệt độ cao nhất khoảng 26 độ.","Thành phố Đà Nẵng trong đêm nay không mưa, se se lạnh 20 độ. Ngày mai nắng cả ngày, nhiệt độ cao nhất khoảng 26 độ.",OK,HIGH
4aK4dzPQE7E,48,381.760009765625,393.760009765625,12.0,"Thành phố Hồ Chí Minh đêm nay tạnh giáo 23 độ. Sáng ngày mai và buổi trưa nắng đẹp, nhiệt độ cao nhất 32 độ. Chiều tối mưa trái mùa quay trở lại, chủ yếu là mưa rào ngắt cổ ắng rất nhanh.","Thành phố Hồ Chí Minh đêm nay tạnh giáo 23 độ. Sáng ngày mai và buổi trưa nắng đẹp, nhiệt độ cao nhất 32 độ. Chiều tối mưa trái mùa quay trở lại, chủ yếu là mưa rào ngắt cổ ắng rất nhanh.","Thành phố Hồ Chí Minh đêm nay tạnh giáo 23 độ. Sáng ngày mai và buổi trưa nắng đẹp, nhiệt độ cao nhất 32 độ. Chiều tối mưa trái mùa quay trở lại, chủ yếu là mưa rào ngắt cổ ắng rất nhanh.",OK,HIGH
4aK4dzPQE7E,49,397.760009765625,407.760009765625,10.0,Hãy subscribe cho kênh Ghiền Mì Gõ Để không bỏ lỡ những video hấp dẫn,Hãy subscribe cho kênh Ghiền Mì Gõ Để không bỏ lỡ những video hấp dẫn,Hãy subscribe cho kênh Ghiền Mì Gõ Để không bỏ lỡ những video hấp dẫn,OK,HIGH
