video_id,segment_id,start,end,duration,text_whisper,text_clean,text_final,review_decision,quality_level
I0UATzTwlAw,0,0.0,7.300000190734863,7.300000190734863,Thêm nhiều vị trí sạt lờ cát và tràn xuống đường gây ảnh hưởng đến giao thông trong tối hôm qua tại Bình Thuận.,Thêm nhiều vị trí sạt lờ cát và tràn xuống đường gây ảnh hưởng đến giao thông trong tối hôm qua tại Bình Thuận.,Thêm nhiều vị trí sạt lờ cát và tràn xuống đường gây ảnh hưởng đến giao thông trong tối hôm qua tại Bình Thuận.,OK,HIGH
I0UATzTwlAw,1,7.300000190734863,15.100000381469728,7.800000190734865,"Sau cơn mưa to, cát từ trên đồi của một dự án tại khu vực Hòn Dơm, Phan Thiết tràn xuống đường Xuân Thủy khiến các phương tiện gặp nhiều khó khăn khi lưu thông qua đây.","Sau cơn mưa to, cát từ trên đồi của một dự án tại khu vực Hòn Dơm, Phan Thiết tràn xuống đường Xuân Thủy khiến các phương tiện gặp nhiều khó khăn khi lưu thông qua đây.","Sau cơn mưa to, cát từ trên đồi của một dự án tại khu vực Hòn Dơm, Phan Thiết tràn xuống đường Xuân Thủy khiến các phương tiện gặp nhiều khó khăn khi lưu thông qua đây.",OK,HIGH
I0UATzTwlAw,2,15.100000381469728,25.940000534057617,10.840000152587889,"Nghiêm trọng hơn là cát tràn xuống đường 716 đoạn qua xã Hòa Thắng, huyện Bắc Bình, đoạn đường dài gần 100m phủ đầy cát với độ dày khoảng nửa mét khi các xe không thể lưu thông qua và xếp hàng đứng chờ.","Nghiêm trọng hơn là cát tràn xuống đường 716 đoạn qua xã Hòa Thắng, huyện Bắc Bình, đoạn đường dài gần 100m phủ đầy cát với độ dày khoảng nửa mét khi các xe không thể lưu thông qua và xếp hàng đứng chờ.","Nghiêm trọng hơn là cát tràn xuống đường 716 đoạn qua xã Hòa Thắng, huyện Bắc Bình, đoạn đường dài gần 100m phủ đầy cát với độ dày khoảng nửa mét khi các xe không thể lưu thông qua và xếp hàng đứng chờ.",OK,HIGH
I0UATzTwlAw,3,25.940000534057617,28.780000686645508,2.8400001525878906,Đến hơn 23 giờ đêm qua thì vị trí này cơ bản thông xe.,Đến hơn 23 giờ đêm qua thì vị trí này cơ bản thông xe.,Đến hơn 23 giờ đêm qua thì vị trí này cơ bản thông xe.,OK,HIGH
I0UATzTwlAw,4,28.780000686645508,34.779998779296875,5.999998092651367,"Còn tại vị trí sạt lờ trên đường Huỳnh Thúc Kháng cách đây 4 ngày, tối qua vẫn có hiện tượng cát sạt lờ tràn xuống.","Còn tại vị trí sạt lờ trên đường Huỳnh Thúc Kháng cách đây 4 ngày, tối qua vẫn có hiện tượng cát sạt lờ tràn xuống.","Còn tại vị trí sạt lờ trên đường Huỳnh Thúc Kháng cách đây 4 ngày, tối qua vẫn có hiện tượng cát sạt lờ tràn xuống.",OK,HIGH
