video_id,segment_id,start,end,duration,text_whisper,text_clean,text_final,review_decision,quality_level
c4xACrQYiOk,0,0.0,7.0,7.0,"Bây giờ sẽ là những thông tin dự báo thời tiết. Anh Tùng, sáng ngày hôm nay trời mù đến chiều, tưởng nắng mù hơn.","Bây giờ sẽ là những thông tin dự báo thời tiết. Anh Tùng, sáng ngày hôm nay trời mù đến chiều, tưởng nắng mù hơn.","Bây giờ sẽ là những thông tin dự báo thời tiết. Anh Tùng, sáng ngày hôm nay trời mù đến chiều, tưởng nắng mù hơn.",OK,HIGH
c4xACrQYiOk,1,7.0,9.0,2.0,Không biết là trời có mưa không ạ?,Không biết là trời có mưa không ạ?,Không biết là trời có mưa không ạ?,OK,HIGH
c4xACrQYiOk,2,9.0,11.0,2.0,"Sẽ là có, và chủ yếu là về đêm và sáng sớm ạ.","Sẽ là có, và chủ yếu là về đêm và sáng sớm ạ.","Sẽ là có, và chủ yếu là về đêm và sáng sớm ạ.",OK,HIGH
c4xACrQYiOk,3,11.0,15.0,4.0,Rõ ràng là ngày hôm nay chúng ta thấy là thời tiết đã có một sự chuyển biến rất là rõ so với hôm qua.,Rõ ràng là ngày hôm nay chúng ta thấy là thời tiết đã có một sự chuyển biến rất là rõ so với hôm qua.,Rõ ràng là ngày hôm nay chúng ta thấy là thời tiết đã có một sự chuyển biến rất là rõ so với hôm qua.,OK,HIGH
c4xACrQYiOk,4,15.0,18.0,3.0,Đó là trời không còn bỏng mây và nắng nữa.,Đó là trời không còn bỏng mây và nắng nữa.,Đó là trời không còn bỏng mây và nắng nữa.,OK,HIGH
c4xACrQYiOk,5,18.0,25.0,7.0,"Và thưa quý vị, cụ thể thay vào đó là một lớp mây dày hiện đang bao phủ hầu khắp cả miền Bắc, trong đó có thủ đô Hà Nội.","Và thưa quý vị, cụ thể thay vào đó là một lớp mây dày hiện đang bao phủ hầu khắp cả miền Bắc, trong đó có thủ đô Hà Nội.","Và thưa quý vị, cụ thể thay vào đó là một lớp mây dày hiện đang bao phủ hầu khắp cả miền Bắc, trong đó có thủ đô Hà Nội.",OK,HIGH
c4xACrQYiOk,6,25.0,33.0,8.0,"Nguyên nhân đó là bởi vì không khí lạnh suy yếu, gió Đông Bắc dần chuyển thành hướng gió Đông Nam, mang nhiều ẩm từ biển vào trong đất liền.","Nguyên nhân đó là bởi vì không khí lạnh suy yếu, gió Đông Bắc dần chuyển thành hướng gió Đông Nam, mang nhiều ẩm từ biển vào trong đất liền.","Nguyên nhân đó là bởi vì không khí lạnh suy yếu, gió Đông Bắc dần chuyển thành hướng gió Đông Nam, mang nhiều ẩm từ biển vào trong đất liền.",OK,HIGH
c4xACrQYiOk,7,33.0,40.0,7.0,"Và theo dự báo là những luồng gió Đông Nam này sẽ còn tiếp tục hoạt động mạnh hơn nữa trong đêm nay và sáng mai, tương ứng với những đường gió dày hơn như thế này.","Và theo dự báo là những luồng gió Đông Nam này sẽ còn tiếp tục hoạt động mạnh hơn nữa trong đêm nay và sáng mai, tương ứng với những đường gió dày hơn như thế này.","Và theo dự báo là những luồng gió Đông Nam này sẽ còn tiếp tục hoạt động mạnh hơn nữa trong đêm nay và sáng mai, tương ứng với những đường gió dày hơn như thế này.",OK,HIGH
c4xACrQYiOk,8,40.0,45.0,5.0,"Và ẩm cao cộng với một nền nhiệt thấp về đêm và sáng sớm dưới 20 độ,","Và ẩm cao cộng với một nền nhiệt thấp về đêm và sáng sớm dưới 20 độ,","Và ẩm cao cộng với một nền nhiệt thấp về đêm và sáng sớm dưới 20 độ,",OK,HIGH
c4xACrQYiOk,9,45.0,50.0,5.0,"thì sẽ dễ làm cho hơi nước bão hòa, hình thành một lớp sương mù bao phủ ở miền Bắc.","thì sẽ dễ làm cho hơi nước bão hòa, hình thành một lớp sương mù bao phủ ở miền Bắc.","thì sẽ dễ làm cho hơi nước bão hòa, hình thành một lớp sương mù bao phủ ở miền Bắc.",OK,HIGH
c4xACrQYiOk,10,50.0,55.0,5.0,"Thậm chí là còn xảy ra cả mưa nhỏ, mưa phồn, và nhất là ở phía Đông Bắc Bộ.","Thậm chí là còn xảy ra cả mưa nhỏ, mưa phồn, và nhất là ở phía Đông Bắc Bộ.","Thậm chí là còn xảy ra cả mưa nhỏ, mưa phồn, và nhất là ở phía Đông Bắc Bộ.",OK,HIGH
c4xACrQYiOk,11,55.0,60.0,5.0,Trong tình trạng như thế này thì tầm nhìn sẽ bị hạn chế hầu hết chỉ từ 1 cho đến 2 km thôi.,Trong tình trạng như thế này thì tầm nhìn sẽ bị hạn chế hầu hết chỉ từ 1 cho đến 2 km thôi.,Trong tình trạng như thế này thì tầm nhìn sẽ bị hạn chế hầu hết chỉ từ 1 cho đến 2 km thôi.,OK,HIGH
c4xACrQYiOk,12,60.0,67.0,7.0,"Thậm chí là những nơi có sương dày thì tầm nhìn còn giảm xuống dưới 500m, sẽ gây cản trở cho việc điều khiển các phương tiện giao thông.","Thậm chí là những nơi có sương dày thì tầm nhìn còn giảm xuống dưới 500m, sẽ gây cản trở cho việc điều khiển các phương tiện giao thông.","Thậm chí là những nơi có sương dày thì tầm nhìn còn giảm xuống dưới 500m, sẽ gây cản trở cho việc điều khiển các phương tiện giao thông.",OK,HIGH
c4xACrQYiOk,13,67.0,74.0,7.0,"Chỉ vì vậy quý vị chú ý là khi chúng ta di chuyển trong khoảng thời gian từ 4 đến 8 giờ sáng, hãy chú ý đến các biện pháp an toàn.","Chỉ vì vậy quý vị chú ý là khi chúng ta di chuyển trong khoảng thời gian từ 4 đến 8 giờ sáng, hãy chú ý đến các biện pháp an toàn.","Chỉ vì vậy quý vị chú ý là khi chúng ta di chuyển trong khoảng thời gian từ 4 đến 8 giờ sáng, hãy chú ý đến các biện pháp an toàn.",OK,HIGH
c4xACrQYiOk,14,74.0,78.0,4.0,Nhất là các cung đường đèo núi thì thường bị khuất về tầm nhìn.,Nhất là các cung đường đèo núi thì thường bị khuất về tầm nhìn.,Nhất là các cung đường đèo núi thì thường bị khuất về tầm nhìn.,OK,HIGH
c4xACrQYiOk,15,78.0,84.0,6.0,Và thêm với việc là có một lớp sương mù mệt đường trơn trượt nữa thì càng khó khăn hơn.,Và thêm với việc là có một lớp sương mù mệt đường trơn trượt nữa thì càng khó khăn hơn.,Và thêm với việc là có một lớp sương mù mệt đường trơn trượt nữa thì càng khó khăn hơn.,OK,HIGH
c4xACrQYiOk,16,84.0,92.0,8.0,Quý vị hãy chú ý là chúng ta nên di chuyển chậm lại và hãy giữ một khoảng cách đủ an toàn với những xe phía trước để dễ dàng có thể xử lý các sự cố xảy ra.,Quý vị hãy chú ý là chúng ta nên di chuyển chậm lại và hãy giữ một khoảng cách đủ an toàn với những xe phía trước để dễ dàng có thể xử lý các sự cố xảy ra.,Quý vị hãy chú ý là chúng ta nên di chuyển chậm lại và hãy giữ một khoảng cách đủ an toàn với những xe phía trước để dễ dàng có thể xử lý các sự cố xảy ra.,OK,HIGH
c4xACrQYiOk,17,92.0,97.0,5.0,Còn sau đây thì chúng tôi sẽ chuyển sang vần dự báo chi tiết cho các thành phố trong đêm nay và ngày mai.,Còn sau đây thì chúng tôi sẽ chuyển sang vần dự báo chi tiết cho các thành phố trong đêm nay và ngày mai.,Còn sau đây thì chúng tôi sẽ chuyển sang vần dự báo chi tiết cho các thành phố trong đêm nay và ngày mai.,OK,HIGH
c4xACrQYiOk,18,97.0,102.0,5.0,"Thủ đô Hà Nội dự báo đêm nay và sáng mai có mưa nhỏ, mưa phồn kèm theo sương mù.","Thủ đô Hà Nội dự báo đêm nay và sáng mai có mưa nhỏ, mưa phồn kèm theo sương mù.","Thủ đô Hà Nội dự báo đêm nay và sáng mai có mưa nhỏ, mưa phồn kèm theo sương mù.",OK,HIGH
c4xACrQYiOk,19,102.0,104.0,2.0,"Nhật độ thấp nhất là 20 độ, khá lạnh.","Nhật độ thấp nhất là 20 độ, khá lạnh.","Nhật độ thấp nhất là 20 độ, khá lạnh.",OK,HIGH
c4xACrQYiOk,20,104.0,108.0,4.0,"Đến trưa chiều mai thì trời nhiều mây, nhật độ khoảng 24 độ.","Đến trưa chiều mai thì trời nhiều mây, nhật độ khoảng 24 độ.","Đến trưa chiều mai thì trời nhiều mây, nhật độ khoảng 24 độ.",OK,HIGH
c4xACrQYiOk,21,108.0,112.0,4.0,"Thành phố Đà Nẵng trời tạnh ráo, đêm nay xe lạnh 22 độ.","Thành phố Đà Nẵng trời tạnh ráo, đêm nay xe lạnh 22 độ.","Thành phố Đà Nẵng trời tạnh ráo, đêm nay xe lạnh 22 độ.",OK,HIGH
c4xACrQYiOk,22,112.0,116.0,4.0,"Trưa chiều mai có nắng, nhật độ tăng dần lên 28 độ.","Trưa chiều mai có nắng, nhật độ tăng dần lên 28 độ.","Trưa chiều mai có nắng, nhật độ tăng dần lên 28 độ.",OK,HIGH
c4xACrQYiOk,23,116.0,120.0,4.0,"Thành phố Hồ Chí Minh đêm nay không mưa, 26 độ trời mát.","Thành phố Hồ Chí Minh đêm nay không mưa, 26 độ trời mát.","Thành phố Hồ Chí Minh đêm nay không mưa, 26 độ trời mát.",OK,HIGH
c4xACrQYiOk,24,120.0,124.0,4.0,"Ngày mai thì tiếp tục nắng gắt và nóng, nhất là trong khoảng từ 11 cho đến 16 giờ.","Ngày mai thì tiếp tục nắng gắt và nóng, nhất là trong khoảng từ 11 cho đến 16 giờ.","Ngày mai thì tiếp tục nắng gắt và nóng, nhất là trong khoảng từ 11 cho đến 16 giờ.",OK,HIGH
c4xACrQYiOk,25,124.0,126.0,2.0,Nhật độ cao nhất là 36 độ.,Nhật độ cao nhất là 36 độ.,Nhật độ cao nhất là 36 độ.,OK,HIGH
c4xACrQYiOk,26,134.0,138.0,4.0,Hãy subscribe cho kênh Ghiền Mì Gõ Để không bỏ lỡ những video hấp dẫn,Hãy subscribe cho kênh Ghiền Mì Gõ Để không bỏ lỡ những video hấp dẫn,Hãy subscribe cho kênh Ghiền Mì Gõ Để không bỏ lỡ những video hấp dẫn,OK,HIGH
