video_id,segment_id,start,end,duration,text_whisper,text_clean,text_final,review_decision,quality_level
rpM93fj02kY,0,0.0,8.0,8.0,Đồng bằng sông Cửu Long đang trải qua những ngày cao điểm mùa khô và cũng là lúc các đợt sâm nhập mặn vào sâu trong đất liền.,Đồng bằng sông Cửu Long đang trải qua những ngày cao điểm mùa khô và cũng là lúc các đợt sâm nhập mặn vào sâu trong đất liền.,Đồng bằng sông Cửu Long đang trải qua những ngày cao điểm mùa khô và cũng là lúc các đợt sâm nhập mặn vào sâu trong đất liền.,OK,HIGH
rpM93fj02kY,1,8.0,12.0,4.0,Vậy đến thời điểm này thì đã có thể đánh giá được mức độ sâm nhập mặn hay chưa?,Vậy đến thời điểm này thì đã có thể đánh giá được mức độ sâm nhập mặn hay chưa?,Vậy đến thời điểm này thì đã có thể đánh giá được mức độ sâm nhập mặn hay chưa?,OK,HIGH
rpM93fj02kY,2,12.0,15.0,3.0,Bây giờ thì chúng ta sẽ cùng đặt câu hỏi này với chị Hải Yến.,Bây giờ thì chúng ta sẽ cùng đặt câu hỏi này với chị Hải Yến.,Bây giờ thì chúng ta sẽ cùng đặt câu hỏi này với chị Hải Yến.,OK,HIGH
rpM93fj02kY,3,15.0,18.0,3.0,"Vâng ạ, để có thể đánh giá được mức độ sâm nhập mặn,","Vâng ạ, để có thể đánh giá được mức độ sâm nhập mặn,","Vâng ạ, để có thể đánh giá được mức độ sâm nhập mặn,",OK,HIGH
rpM93fj02kY,4,18.0,24.0,6.0,thì hiện nay từ đầu năm đến giờ thì ở khu vực đồng bằng sông Cửu Long đã trải qua tổng cộng là 4 đợt sâm nhập mặn.,thì hiện nay từ đầu năm đến giờ thì ở khu vực đồng bằng sông Cửu Long đã trải qua tổng cộng là 4 đợt sâm nhập mặn.,thì hiện nay từ đầu năm đến giờ thì ở khu vực đồng bằng sông Cửu Long đã trải qua tổng cộng là 4 đợt sâm nhập mặn.,OK,HIGH
rpM93fj02kY,5,24.0,30.0,6.0,"Tuy nhiên, mức độ không nghiêm trọng bằng năm ngoái, năm 2020, một năm được đánh giá là hạ mặt kỷ lục.","Tuy nhiên, mức độ không nghiêm trọng bằng năm ngoái, năm 2020, một năm được đánh giá là hạ mặt kỷ lục.","Tuy nhiên, mức độ không nghiêm trọng bằng năm ngoái, năm 2020, một năm được đánh giá là hạ mặt kỷ lục.",OK,HIGH
rpM93fj02kY,6,30.0,36.0,6.0,"Vì vậy mà hiện chưa xảy ra tình trạng thiếu nước trong các hệ thống công trình thủy lợi, cũng như trong sản xuất.","Vì vậy mà hiện chưa xảy ra tình trạng thiếu nước trong các hệ thống công trình thủy lợi, cũng như trong sản xuất.","Vì vậy mà hiện chưa xảy ra tình trạng thiếu nước trong các hệ thống công trình thủy lợi, cũng như trong sản xuất.",OK,HIGH
rpM93fj02kY,7,36.0,43.0,7.0,"Các đợt sâm nhập mặn vừa qua thường chỉ diễn ra thời đoạn ngắn vài ngày, theo kỳ triều cường, chứ không triển miên như năm ngoái.","Các đợt sâm nhập mặn vừa qua thường chỉ diễn ra thời đoạn ngắn vài ngày, theo kỳ triều cường, chứ không triển miên như năm ngoái.","Các đợt sâm nhập mặn vừa qua thường chỉ diễn ra thời đoạn ngắn vài ngày, theo kỳ triều cường, chứ không triển miên như năm ngoái.",OK,HIGH
rpM93fj02kY,8,43.0,50.0,7.0,Danh mặn 4-gam-trên-lít sâm nhập vào sâu nhất từ đầu mùa đến giờ trên các nhánh sông khoảng 45-67 km.,Danh mặn 4-gam-trên-lít sâm nhập vào sâu nhất từ đầu mùa đến giờ trên các nhánh sông khoảng 45-67 km.,Danh mặn 4-gam-trên-lít sâm nhập vào sâu nhất từ đầu mùa đến giờ trên các nhánh sông khoảng 45-67 km.,OK,HIGH
rpM93fj02kY,9,51.0,57.0,6.0,"Và nếu so sánh với 2 năm hạ mặt khốc đỉa trước là vào năm 2020 và năm 2016,","Và nếu so sánh với 2 năm hạ mặt khốc đỉa trước là vào năm 2020 và năm 2016,","Và nếu so sánh với 2 năm hạ mặt khốc đỉa trước là vào năm 2020 và năm 2016,",OK,HIGH
rpM93fj02kY,10,57.0,61.0,4.0,thì năm nay đường danh mặn thấp hơn từ 10-50 km.,thì năm nay đường danh mặn thấp hơn từ 10-50 km.,thì năm nay đường danh mặn thấp hơn từ 10-50 km.,OK,HIGH
rpM93fj02kY,11,63.0,68.0,5.0,"Vâng, sớm nhà mặn tại khu vực đồng bằng sông Cửu Long mới đi được có khoảng nửa chặng đường thôi.","Vâng, sớm nhà mặn tại khu vực đồng bằng sông Cửu Long mới đi được có khoảng nửa chặng đường thôi.","Vâng, sớm nhà mặn tại khu vực đồng bằng sông Cửu Long mới đi được có khoảng nửa chặng đường thôi.",OK,HIGH
rpM93fj02kY,12,68.0,72.0,4.0,Vậy thì diễn biến tới đây sẽ như thế nào và bà con cần phải chuẩn bị những gì chị?,Vậy thì diễn biến tới đây sẽ như thế nào và bà con cần phải chuẩn bị những gì chị?,Vậy thì diễn biến tới đây sẽ như thế nào và bà con cần phải chuẩn bị những gì chị?,OK,HIGH
rpM93fj02kY,13,72.0,78.0,6.0,Dự báo là sâm nhập mặn vào thời điểm cao điển sẽ kéo dài trong khoảng 1 tháng tới đây.,Dự báo là sâm nhập mặn vào thời điểm cao điển sẽ kéo dài trong khoảng 1 tháng tới đây.,Dự báo là sâm nhập mặn vào thời điểm cao điển sẽ kéo dài trong khoảng 1 tháng tới đây.,OK,HIGH
rpM93fj02kY,14,78.0,83.0,5.0,Mà các chuyên gia nhận định rằng những đợt sâm nhập mặn tới đây còn có thể cao hơn những đợt trước,Mà các chuyên gia nhận định rằng những đợt sâm nhập mặn tới đây còn có thể cao hơn những đợt trước,Mà các chuyên gia nhận định rằng những đợt sâm nhập mặn tới đây còn có thể cao hơn những đợt trước,OK,HIGH
rpM93fj02kY,15,83.0,85.0,2.0,và thậm chí còn cao hơn chung mình nhiều năm nữa.,và thậm chí còn cao hơn chung mình nhiều năm nữa.,và thậm chí còn cao hơn chung mình nhiều năm nữa.,OK,HIGH
rpM93fj02kY,16,85.0,91.0,6.0,"Chính vì vậy trong thời gian này bà con không được chủ quan, nhất là những người dân ở khu vực ven biển.","Chính vì vậy trong thời gian này bà con không được chủ quan, nhất là những người dân ở khu vực ven biển.","Chính vì vậy trong thời gian này bà con không được chủ quan, nhất là những người dân ở khu vực ven biển.",OK,HIGH
rpM93fj02kY,17,93.0,99.0,6.0,"Ngay trong đợt mặn từ nay đến ngày 16 tháng 3, danh mặn 4-gam-trên-lít trên sông Vàm Cỏ,","Ngay trong đợt mặn từ nay đến ngày 16 tháng 3, danh mặn 4-gam-trên-lít trên sông Vàm Cỏ,","Ngay trong đợt mặn từ nay đến ngày 16 tháng 3, danh mặn 4-gam-trên-lít trên sông Vàm Cỏ,",OK,HIGH
rpM93fj02kY,18,99.0,106.0,7.0,"mặn sẽ vào sâu hơn các đợt trước từ 13-15 km, vào đến xã Bình Đức và xã Mỹ An của Long An.","mặn sẽ vào sâu hơn các đợt trước từ 13-15 km, vào đến xã Bình Đức và xã Mỹ An của Long An.","mặn sẽ vào sâu hơn các đợt trước từ 13-15 km, vào đến xã Bình Đức và xã Mỹ An của Long An.",OK,HIGH
rpM93fj02kY,19,106.0,111.0,5.0,"Mặn sẽ gây thiệt hại lớn vào sâu hơn từ 1-3 km, tới xã Vĩnh Phước B, tỉnh Kiên Giang.","Mặn sẽ gây thiệt hại lớn vào sâu hơn từ 1-3 km, tới xã Vĩnh Phước B, tỉnh Kiên Giang.","Mặn sẽ gây thiệt hại lớn vào sâu hơn từ 1-3 km, tới xã Vĩnh Phước B, tỉnh Kiên Giang.",OK,HIGH
rpM93fj02kY,20,121.0,127.0,6.0,"Chú ý trong các đợt sâm nhập mặn này sẽ có thời điểm mặn tăng cao đột biến do chiều cường và gió trướng,","Chú ý trong các đợt sâm nhập mặn này sẽ có thời điểm mặn tăng cao đột biến do chiều cường và gió trướng,","Chú ý trong các đợt sâm nhập mặn này sẽ có thời điểm mặn tăng cao đột biến do chiều cường và gió trướng,",OK,HIGH
rpM93fj02kY,21,127.0,133.0,6.0,đặc biệt ở những vùng ven biển nếu không theo dõi mặn thường xuyên có thể gây thiệt hại lớn đến lúa và cây trồng.,đặc biệt ở những vùng ven biển nếu không theo dõi mặn thường xuyên có thể gây thiệt hại lớn đến lúa và cây trồng.,đặc biệt ở những vùng ven biển nếu không theo dõi mặn thường xuyên có thể gây thiệt hại lớn đến lúa và cây trồng.,OK,HIGH
rpM93fj02kY,22,136.0,141.0,5.0,"Chú ý trong các đợt sâm nhập mặn này sẽ có thời điểm mặn tăng cao đột biến do chiều cường và gió trướng,","Chú ý trong các đợt sâm nhập mặn này sẽ có thời điểm mặn tăng cao đột biến do chiều cường và gió trướng,","Chú ý trong các đợt sâm nhập mặn này sẽ có thời điểm mặn tăng cao đột biến do chiều cường và gió trướng,",OK,HIGH
rpM93fj02kY,23,141.0,146.0,5.0,đặc biệt ở những vùng ven biển nếu không theo dõi mặn thường xuyên có thể gây thiệt hại lớn đến lúa và cây trồng.,đặc biệt ở những vùng ven biển nếu không theo dõi mặn thường xuyên có thể gây thiệt hại lớn đến lúa và cây trồng.,đặc biệt ở những vùng ven biển nếu không theo dõi mặn thường xuyên có thể gây thiệt hại lớn đến lúa và cây trồng.,OK,HIGH
rpM93fj02kY,24,146.0,167.0,21.0,"Dù cho bùa khô năm nay không khốc liệt bằng mọi năm,","Dù cho bùa khô năm nay không khốc liệt bằng mọi năm,","Dù cho bùa khô năm nay không khốc liệt bằng mọi năm,",OK,HIGH
rpM93fj02kY,25,167.0,172.0,5.0,nguồn nước đã được chủ động nhưng rõ ràng là vẫn có thời điểm mặn cao hơn mọi năm.,nguồn nước đã được chủ động nhưng rõ ràng là vẫn có thời điểm mặn cao hơn mọi năm.,nguồn nước đã được chủ động nhưng rõ ràng là vẫn có thời điểm mặn cao hơn mọi năm.,OK,HIGH
rpM93fj02kY,26,173.0,179.0,6.0,"Khi mà biến đổi khí hậu gây ra hạn hán, nguồn nước thượng nguồn sụt giảm thì sâm nhập mặn sẽ ngày càng nghiêm trọng hơn.","Khi mà biến đổi khí hậu gây ra hạn hán, nguồn nước thượng nguồn sụt giảm thì sâm nhập mặn sẽ ngày càng nghiêm trọng hơn.","Khi mà biến đổi khí hậu gây ra hạn hán, nguồn nước thượng nguồn sụt giảm thì sâm nhập mặn sẽ ngày càng nghiêm trọng hơn.",OK,HIGH
rpM93fj02kY,27,179.0,183.0,4.0,Khi đó thiếu nước sẽ không còn là nguy cơ mà sẽ là điều hiển nhiên.,Khi đó thiếu nước sẽ không còn là nguy cơ mà sẽ là điều hiển nhiên.,Khi đó thiếu nước sẽ không còn là nguy cơ mà sẽ là điều hiển nhiên.,OK,HIGH
rpM93fj02kY,28,183.0,187.0,4.0,Vì vậy ngay từ bây giờ bà con cần chủ động thích ứng.,Vì vậy ngay từ bây giờ bà con cần chủ động thích ứng.,Vì vậy ngay từ bây giờ bà con cần chủ động thích ứng.,OK,HIGH
rpM93fj02kY,29,187.0,193.0,6.0,"Cách trữ nước ngọt trong các ao nổi ở Bến Tre, Tiền Giang cũng là một giải pháp có thể áp dụng cho nhiều tình thành khác","Cách trữ nước ngọt trong các ao nổi ở Bến Tre, Tiền Giang cũng là một giải pháp có thể áp dụng cho nhiều tình thành khác","Cách trữ nước ngọt trong các ao nổi ở Bến Tre, Tiền Giang cũng là một giải pháp có thể áp dụng cho nhiều tình thành khác",OK,HIGH
rpM93fj02kY,30,193.0,199.0,6.0,để bà con có thể bảo vệ các vườn cây ăn trái và có nguồn nước ngọt sinh hoạt trong mỗi mùa hạn mặn.,để bà con có thể bảo vệ các vườn cây ăn trái và có nguồn nước ngọt sinh hoạt trong mỗi mùa hạn mặn.,để bà con có thể bảo vệ các vườn cây ăn trái và có nguồn nước ngọt sinh hoạt trong mỗi mùa hạn mặn.,OK,HIGH
rpM93fj02kY,31,203.0,208.0,5.0,Thời tiết ở khu vực Đồng bằng Sông Cửu Long có gì đáng lưu ý sắp tới hay không?,Thời tiết ở khu vực Đồng bằng Sông Cửu Long có gì đáng lưu ý sắp tới hay không?,Thời tiết ở khu vực Đồng bằng Sông Cửu Long có gì đáng lưu ý sắp tới hay không?,OK,HIGH
rpM93fj02kY,32,208.0,210.0,2.0,"Có mưa gió gì, mưa trái mùa gì không?","Có mưa gió gì, mưa trái mùa gì không?","Có mưa gió gì, mưa trái mùa gì không?",OK,HIGH
rpM93fj02kY,33,210.0,214.0,4.0,Dự báo là trong khoảng một tuần tới thì ở khu vực Đồng bằng Sông Cửu Long vẫn sẽ xảy ra mưa trái mùa.,Dự báo là trong khoảng một tuần tới thì ở khu vực Đồng bằng Sông Cửu Long vẫn sẽ xảy ra mưa trái mùa.,Dự báo là trong khoảng một tuần tới thì ở khu vực Đồng bằng Sông Cửu Long vẫn sẽ xảy ra mưa trái mùa.,OK,HIGH
rpM93fj02kY,34,214.0,218.0,4.0,Tuy nhiên thì mưa chỉ xảy ra trên diện hẹp thôi ạ và với lượng không đáng kể.,Tuy nhiên thì mưa chỉ xảy ra trên diện hẹp thôi ạ và với lượng không đáng kể.,Tuy nhiên thì mưa chỉ xảy ra trên diện hẹp thôi ạ và với lượng không đáng kể.,OK,HIGH
rpM93fj02kY,35,218.0,221.0,3.0,Tiết trở chủ đạo tại đây thì vẫn sẽ là nắng mạnh và nóng.,Tiết trở chủ đạo tại đây thì vẫn sẽ là nắng mạnh và nóng.,Tiết trở chủ đạo tại đây thì vẫn sẽ là nắng mạnh và nóng.,OK,HIGH
rpM93fj02kY,36,221.0,225.0,4.0,Nên chính vì vậy mà thời điểm này bà con cần phải thực sự sử dụng tiết kiệm nước ngọt.,Nên chính vì vậy mà thời điểm này bà con cần phải thực sự sử dụng tiết kiệm nước ngọt.,Nên chính vì vậy mà thời điểm này bà con cần phải thực sự sử dụng tiết kiệm nước ngọt.,OK,HIGH
rpM93fj02kY,37,225.0,229.0,4.0,Và cụ thể về tình hình nhiệt độ ra sao thì ngay bây giờ chúng ta sẽ cùng theo dõi trên màn hình đây.,Và cụ thể về tình hình nhiệt độ ra sao thì ngay bây giờ chúng ta sẽ cùng theo dõi trên màn hình đây.,Và cụ thể về tình hình nhiệt độ ra sao thì ngay bây giờ chúng ta sẽ cùng theo dõi trên màn hình đây.,OK,HIGH
rpM93fj02kY,38,232.0,236.0,4.0,"Vâng thưa quý vị, ngay trong ngày mai thì ở khu vực Đồng bằng Sông Cửu Long cũng như là khắp Nam Bộ","Vâng thưa quý vị, ngay trong ngày mai thì ở khu vực Đồng bằng Sông Cửu Long cũng như là khắp Nam Bộ","Vâng thưa quý vị, ngay trong ngày mai thì ở khu vực Đồng bằng Sông Cửu Long cũng như là khắp Nam Bộ",OK,HIGH
rpM93fj02kY,39,236.0,238.0,2.0,trời sẽ nắng liên tục cả chục tiếng trong ngày.,trời sẽ nắng liên tục cả chục tiếng trong ngày.,trời sẽ nắng liên tục cả chục tiếng trong ngày.,OK,HIGH
rpM93fj02kY,40,238.0,241.0,3.0,"Với mức nhiệt cao nhất tại khu vực Đồng bằng Sông Cửu Long,","Với mức nhiệt cao nhất tại khu vực Đồng bằng Sông Cửu Long,","Với mức nhiệt cao nhất tại khu vực Đồng bằng Sông Cửu Long,",OK,HIGH
rpM93fj02kY,41,241.0,245.0,4.0,giao động quanh ngưỡng khoảng là từ 33 cho đến là 34 độ.,giao động quanh ngưỡng khoảng là từ 33 cho đến là 34 độ.,giao động quanh ngưỡng khoảng là từ 33 cho đến là 34 độ.,OK,HIGH
rpM93fj02kY,42,245.0,249.0,4.0,"Còn ở miền Đông, nhiều nơi cũng sẽ xảy ra nắng nóng như là tại thành phố Hồ Chí Minh,","Còn ở miền Đông, nhiều nơi cũng sẽ xảy ra nắng nóng như là tại thành phố Hồ Chí Minh,","Còn ở miền Đông, nhiều nơi cũng sẽ xảy ra nắng nóng như là tại thành phố Hồ Chí Minh,",OK,HIGH
rpM93fj02kY,43,249.0,252.0,3.0,"Biên Hòa, Phước Long, Thủ Dầu Một hay là Tây Ninh.","Biên Hòa, Phước Long, Thủ Dầu Một hay là Tây Ninh.","Biên Hòa, Phước Long, Thủ Dầu Một hay là Tây Ninh.",OK,HIGH
rpM93fj02kY,44,252.0,256.0,4.0,Mức nhiệt tại đây khoảng là từ 35 cho đến là 36 độ.,Mức nhiệt tại đây khoảng là từ 35 cho đến là 36 độ.,Mức nhiệt tại đây khoảng là từ 35 cho đến là 36 độ.,OK,HIGH
rpM93fj02kY,45,256.0,263.0,7.0,Nắng nóng ở miền Đông cũng như là tại khu vực thành phố Hồ Chí Minh thì sẽ duy trì trong ít nhất khoảng là vào 2 ngày tới,Nắng nóng ở miền Đông cũng như là tại khu vực thành phố Hồ Chí Minh thì sẽ duy trì trong ít nhất khoảng là vào 2 ngày tới,Nắng nóng ở miền Đông cũng như là tại khu vực thành phố Hồ Chí Minh thì sẽ duy trì trong ít nhất khoảng là vào 2 ngày tới,OK,HIGH
rpM93fj02kY,46,263.0,266.0,3.0,với mức nhiệt cao nhất là 35 độ.,với mức nhiệt cao nhất là 35 độ.,với mức nhiệt cao nhất là 35 độ.,OK,HIGH
rpM93fj02kY,47,266.0,270.0,4.0,"Sau đó thì từ ngày thứ 3 tuần sau, tức là rơi vào ngày 16 tháng 3,","Sau đó thì từ ngày thứ 3 tuần sau, tức là rơi vào ngày 16 tháng 3,","Sau đó thì từ ngày thứ 3 tuần sau, tức là rơi vào ngày 16 tháng 3,",OK,HIGH
rpM93fj02kY,48,270.0,274.0,4.0,"thì thời tiết sẽ dịu bớt, nhiệt độ giảm xuống còn khoảng là 34 độ,","thì thời tiết sẽ dịu bớt, nhiệt độ giảm xuống còn khoảng là 34 độ,","thì thời tiết sẽ dịu bớt, nhiệt độ giảm xuống còn khoảng là 34 độ,",OK,HIGH
rpM93fj02kY,49,274.0,278.0,4.0,với độ ẩm thấp chỉ từ 35 cho đến là 46%.,với độ ẩm thấp chỉ từ 35 cho đến là 46%.,với độ ẩm thấp chỉ từ 35 cho đến là 46%.,OK,HIGH
rpM93fj02kY,50,279.0,284.0,5.0,"Ở Bắc Bộ thì đêm về sáng có sương mù, trưa chiều mai trời tạnh giáo và vẫn sẽ ấm áp.","Ở Bắc Bộ thì đêm về sáng có sương mù, trưa chiều mai trời tạnh giáo và vẫn sẽ ấm áp.","Ở Bắc Bộ thì đêm về sáng có sương mù, trưa chiều mai trời tạnh giáo và vẫn sẽ ấm áp.",OK,HIGH
rpM93fj02kY,51,284.0,287.0,3.0,"Và mức nhiệt cao nhất tại thủ đô Hà Nội cũng như là hầu khắp những nơi khác,","Và mức nhiệt cao nhất tại thủ đô Hà Nội cũng như là hầu khắp những nơi khác,","Và mức nhiệt cao nhất tại thủ đô Hà Nội cũng như là hầu khắp những nơi khác,",OK,HIGH
rpM93fj02kY,52,287.0,292.0,5.0,"giao động quanh ngưỡng là 25 cho đến 27 độ, riêng tại địa miền phủ là 30 độ.","giao động quanh ngưỡng là 25 cho đến 27 độ, riêng tại địa miền phủ là 30 độ.","giao động quanh ngưỡng là 25 cho đến 27 độ, riêng tại địa miền phủ là 30 độ.",OK,HIGH
rpM93fj02kY,53,293.0,297.0,4.0,Còn bây giờ sẽ được chuyển sang thời tiết trong các thành phố khác trong đêm nay và ngày mai.,Còn bây giờ sẽ được chuyển sang thời tiết trong các thành phố khác trong đêm nay và ngày mai.,Còn bây giờ sẽ được chuyển sang thời tiết trong các thành phố khác trong đêm nay và ngày mai.,OK,HIGH
rpM93fj02kY,54,297.0,301.0,4.0,"Hải Phòng đêm về sáng có sương mù nhẹ, thời tiết xe lạnh 20 độ.","Hải Phòng đêm về sáng có sương mù nhẹ, thời tiết xe lạnh 20 độ.","Hải Phòng đêm về sáng có sương mù nhẹ, thời tiết xe lạnh 20 độ.",OK,HIGH
rpM93fj02kY,55,301.0,306.0,5.0,"Trưa chiều mai trời nhiều bây, ấm lên, nhiệt độ cao nhất là 25 độ.","Trưa chiều mai trời nhiều bây, ấm lên, nhiệt độ cao nhất là 25 độ.","Trưa chiều mai trời nhiều bây, ấm lên, nhiệt độ cao nhất là 25 độ.",OK,HIGH
rpM93fj02kY,56,306.0,310.0,4.0,"Đà Nẵng đêm nay sẽ không mưa, nhiệt độ thấp nhất là 22 độ.","Đà Nẵng đêm nay sẽ không mưa, nhiệt độ thấp nhất là 22 độ.","Đà Nẵng đêm nay sẽ không mưa, nhiệt độ thấp nhất là 22 độ.",OK,HIGH
rpM93fj02kY,57,310.0,315.0,5.0,"Ngày mai trời nắng, bổ không khí thoáng mát, nhiệt độ không vượt quá 29 độ.","Ngày mai trời nắng, bổ không khí thoáng mát, nhiệt độ không vượt quá 29 độ.","Ngày mai trời nắng, bổ không khí thoáng mát, nhiệt độ không vượt quá 29 độ.",OK,HIGH
rpM93fj02kY,58,315.0,319.0,4.0,Đà Lạt dự báo đêm nay trời rét chỉ khoảng là 13 độ.,Đà Lạt dự báo đêm nay trời rét chỉ khoảng là 13 độ.,Đà Lạt dự báo đêm nay trời rét chỉ khoảng là 13 độ.,OK,HIGH
rpM93fj02kY,59,319.0,324.0,5.0,"Ngày mai trời nắng và nhiệt độ tăng nhanh so với buổi đêm, lên ức là 28 độ.","Ngày mai trời nắng và nhiệt độ tăng nhanh so với buổi đêm, lên ức là 28 độ.","Ngày mai trời nắng và nhiệt độ tăng nhanh so với buổi đêm, lên ức là 28 độ.",OK,HIGH
rpM93fj02kY,60,336.0,340.0,4.0,Hãy subscribe cho kênh Ghiền Mì Gõ Để không bỏ lỡ những video hấp dẫn,Hãy subscribe cho kênh Ghiền Mì Gõ Để không bỏ lỡ những video hấp dẫn,Hãy subscribe cho kênh Ghiền Mì Gõ Để không bỏ lỡ những video hấp dẫn,OK,HIGH
