video_id,segment_id,start,end,duration,text_whisper,text_clean,text_final,review_decision,quality_level
UOd7g7jhWxk,0,0.0,6.159999847412109,6.159999847412109,"Xin kính chào quý vị, mời quý vị theo dõi Việt Nam hôm nay để cùng cập nhật những diễn biến mới nhất về tình hình mưa lũ miền trung.","Xin kính chào quý vị, mời quý vị theo dõi chương trình Việt Nam hôm nay để cập nhật những diễn biến mới nhất về tình hình mưa lũ tại miền Trung.","Xin kính chào quý vị, mời quý vị theo dõi chương trình Việt Nam hôm nay để cập nhật những diễn biến mới nhất về tình hình mưa lũ tại miền Trung.",OK,HIGH
UOd7g7jhWxk,1,6.760000228881836,12.399999618530273,5.6399993896484375,Một nội lo rất lớn vào thời điểm này đó là cơn bão số 8 khi tiến vào đất liền sẽ gây mưa lớn tại khu vực miền trung.,Một mối lo lớn vào thời điểm này là cơn bão số 8 khi tiến vào đất liền sẽ gây mưa lớn tại khu vực miền Trung.,Một mối lo lớn vào thời điểm này là cơn bão số 8 khi tiến vào đất liền sẽ gây mưa lớn tại khu vực miền Trung.,OK,HIGH
UOd7g7jhWxk,2,12.720000267028809,18.360000610351562,5.640000343322754,"Nước vừa rút thì lại lên, ba con sẽ chở tay không kịp khi một đợt lũ mới sẽ trồng lên lũ.","Nước vừa rút thì lại dâng cao, người dân sẽ không kịp trở tay khi một đợt lũ mới tiếp tục đổ về.","Nước vừa rút thì lại dâng cao, người dân sẽ không kịp trở tay khi một đợt lũ mới tiếp tục đổ về.",OK,HIGH
UOd7g7jhWxk,3,18.360000610351562,23.0,4.6399993896484375,Thông tin về cơn bão này ngay sau đây sẽ được chúng tôi cập nhật cùng với biên tập viên Thế Tiết Quỳnh Hòa.,Thông tin về cơn bão số 8 sẽ được chúng tôi cập nhật ngay sau đây cùng với biên tập viên Thế Tiết Quỳnh Hòa.,Thông tin về cơn bão này ngay sau đây sẽ được chúng tôi cập nhật cùng với biên tập viên Thế Tiết Quỳnh Hòa.,REVERT,HIGH
UOd7g7jhWxk,4,23.0,24.239999771118164,1.239999771118164,Xin mời Chị Quỳnh Hòa.,Xin mời biên tập viên thời tiết Quỳnh Hòa cập nhật thông tin về cơn bão số 8 đang gây mưa lớn tại miền Trung.,Xin mời Chị Quỳnh Hòa.,REVERT,HIGH
UOd7g7jhWxk,5,24.760000228881836,31.239999771118164,6.479999542236328,"Vâng, quả thật, cơn bão số 8 là một cơn bão có diễn biến phức tạp và đến thời điểm này thì những thông tin dự báo về nó còn rất nhiều phân tán.","Cơn bão số 8 thực sự có diễn biến phức tạp và đến thời điểm này, thông tin dự báo về nó vẫn còn rất nhiều sự phân tán.","Cơn bão số 8 thực sự có diễn biến phức tạp và đến thời điểm này, thông tin dự báo về nó vẫn còn rất nhiều sự phân tán.",OK,HIGH
UOd7g7jhWxk,6,31.239999771118164,36.63999938964844,5.399999618530273,"Thưa quý vị và các bạn, hiện tại các mô hình dự báo đường đi của cơn bão còn có rất nhiều sự khác nhau.","Thưa quý vị và các bạn, hiện nay các mô hình dự báo đường đi của cơn bão số 8 vẫn còn rất nhiều sự khác biệt.","Thưa quý vị và các bạn, hiện tại các mô hình dự báo đường đi của cơn bão còn có rất nhiều sự khác nhau.",REVERT,HIGH
UOd7g7jhWxk,7,36.63999938964844,43.63999938964844,7.0,Theo tính toán của mô hình châu Âu đó là đường màu xanh này thì khả năng cơn bão số 8 sẽ trách lên phía bắc.,"Theo tính toán của mô hình châu Âu, khả năng cơn bão số 8 sẽ di chuyển lên phía bắc.","Theo tính toán của mô hình châu Âu, khả năng cơn bão số 8 sẽ di chuyển lên phía bắc.",OK,HIGH
UOd7g7jhWxk,8,43.63999938964844,52.439998626708984,8.799999237060547,"Trong khi đó với mô hình của Nhật là đường màu cam thì lại cho thấy quỹ đạo báo liên tục có sự thay đổi, nó đi lên rồi lại trúc xuống.","Trong khi đó, mô hình dự báo của Nhật Bản (đường màu cam) cho thấy quỹ đạo của cơn bão liên tục thay đổi, với diễn biến đi lên rồi lại đi xuống.","Trong khi đó, mô hình dự báo của Nhật Bản (đường màu cam) cho thấy quỹ đạo của cơn bão liên tục thay đổi, với diễn biến đi lên rồi lại đi xuống.",OK,HIGH
UOd7g7jhWxk,9,52.439998626708984,57.439998626708984,5.0,Như vậy là khả năng cơn bão số 8 này có thể ảnh hưởng trực tiếp tới khu vực đất liền của miền Trung.,Khả năng cơn bão số 8 sẽ ảnh hưởng trực tiếp đến khu vực đất liền miền Trung là điều có thể xảy ra.,Khả năng cơn bão số 8 sẽ ảnh hưởng trực tiếp đến khu vực đất liền miền Trung là điều có thể xảy ra.,OK,HIGH
UOd7g7jhWxk,10,57.439998626708984,65.44000244140625,8.000003814697266,"Có thể ảnh hưởng đến đất liền miền Trung là chưa rõ ràng, vì vậy chúng ta sẽ cần phải theo dõi diễn biến của nó để có những thông tin cụ thể tiếp theo.","Khả năng cơn bão số 8 ảnh hưởng đến đất liền miền Trung vẫn chưa rõ ràng, vì vậy chúng ta cần theo dõi diễn biến của nó để có thông tin cụ thể hơn trong thời gian tới.","Có thể ảnh hưởng đến đất liền miền Trung là chưa rõ ràng, vì vậy chúng ta sẽ cần phải theo dõi diễn biến của nó để có những thông tin cụ thể tiếp theo.",REVERT,MEDIUM
UOd7g7jhWxk,11,65.44000244140625,70.44000244140625,5.0,Điều thứ 2 mà chúng tôi cần lưu ý về cơn bão số 8 này là nó sẽ có cường độ mạnh nhất khi ở trên biển.,Điều thứ hai cần lưu ý về cơn bão số 8 là nó sẽ đạt cường độ mạnh nhất khi còn ở trên biển.,Điều thứ hai cần lưu ý về cơn bão số 8 là nó sẽ đạt cường độ mạnh nhất khi còn ở trên biển.,OK,HIGH
UOd7g7jhWxk,12,70.44000244140625,79.44000244140625,9.0,"Khi tiến tới gần khu vực quần đảo Hoàng Sa thì đây là lúc mà cơn bão mạnh nhất dự báo cường độ lúc đó là cấp 11, cấp 12, giật cấp 14.","Khi tiến gần khu vực quần đảo Hoàng Sa, cơn bão số 8 được dự báo sẽ đạt cường độ mạnh nhất với cấp 11, cấp 12, giật cấp 14.","Khi tiến tới gần khu vực quần đảo Hoàng Sa thì đây là lúc mà cơn bão mạnh nhất dự báo cường độ lúc đó là cấp 11, cấp 12, giật cấp 14.",REVERT,HIGH
UOd7g7jhWxk,13,79.44000244140625,85.44000244140625,6.0,Tuy nhiên sau khi bão đi qua quần đảo Hoàng Sa thì khả năng sẽ giảm nhanh và yếu dần.,"Tuy nhiên, sau khi bão số 8 đi qua quần đảo Hoàng Sa, khả năng sẽ giảm nhanh và yếu dần.",Tuy nhiên sau khi bão đi qua quần đảo Hoàng Sa thì khả năng sẽ giảm nhanh và yếu dần.,REVERT,HIGH
UOd7g7jhWxk,14,85.44000244140625,88.44000244140625,3.0,Vấn đề cần chú ý nhất lúc này đó là gió mạnh ở trên biển.,Vấn đề cần chú ý nhất lúc này là gió mạnh trên biển.,Vấn đề cần chú ý nhất lúc này là gió mạnh trên biển.,OK,HIGH
UOd7g7jhWxk,15,88.44000244140625,97.44000244140625,9.0,"Các tàu thuyền nên chủ động ứng phó với bão khi mà dự báo vùng nguy hiểm trong vòng 24h tới được xác định sẽ là từ vị tuyến 14,5 đến vị tuyến 19","Các tàu thuyền cần chủ động ứng phó với bão, khi dự báo vùng nguy hiểm trong vòng 24 giờ tới được xác định từ vĩ tuyến 14,5 đến vĩ tuyến 19.","Các tàu thuyền cần chủ động ứng phó với bão, khi dự báo vùng nguy hiểm trong vòng 24 giờ tới được xác định từ vĩ tuyến 14,5 đến vĩ tuyến 19.",OK,HIGH
UOd7g7jhWxk,16,97.44000244140625,101.44000244140625,4.0,và từ kinh tuyến 113 cho tới kinh tuyến 119.,Từ kinh tuyến 113 đến kinh tuyến 119 sẽ là vùng nguy hiểm mà các tàu thuyền cần chủ động ứng phó với bão trong vòng 24 giờ tới.,và từ kinh tuyến 113 cho tới kinh tuyến 119.,REVERT,HIGH
UOd7g7jhWxk,17,101.44000244140625,106.44000244140625,5.0,Vì vậy tàu thuyền cần phải chủ động chúng ta không đi vào khu vực này hoặc là phải thoát ra khu vực này.,"Do đó, tàu thuyền cần chủ động không đi vào khu vực này hoặc phải nhanh chóng thoát ra khỏi khu vực này.","Do đó, tàu thuyền cần chủ động không đi vào khu vực này hoặc phải nhanh chóng thoát ra khỏi khu vực này.",OK,HIGH
UOd7g7jhWxk,18,107.44000244140625,110.44000244140625,3.0,Còn về diện biến mưa lũ trên đất liền thì tôi sẽ trở lại sau một ít phút nữa.,"Về diễn biến mưa lũ trên đất liền, chúng tôi sẽ cập nhật thông tin sau ít phút nữa.","Về diễn biến mưa lũ trên đất liền, chúng tôi sẽ cập nhật thông tin sau ít phút nữa.",OK,HIGH
UOd7g7jhWxk,19,110.44000244140625,112.44000244140625,2.0,Còn bây giờ xin mời trở lại với anh tôi là Hoàng Dương.,"Còn bây giờ, xin mời quý vị trở lại với biên tập viên Hoàng Dương.",Còn bây giờ xin mời trở lại với anh tôi là Hoàng Dương.,REVERT,LOW
UOd7g7jhWxk,20,112.44000244140625,114.44000244140625,2.0,Xin cảm ơn biên tập viên thời tiết Quỳnh Hoa.,Xin cảm ơn biên tập viên thời tiết Quỳnh Hoa đã cung cấp những thông tin cập nhật về cơn bão số 8 và tình hình mưa lũ tại miền Trung.,Xin cảm ơn biên tập viên thời tiết Quỳnh Hoa.,REVERT,HIGH
